Sheet: Master Template
I6: Month '17
A9: School Name | K9: Total Amount Instruction | L9: Total Amount Counseling
A10: Instruction Calculation Detail | K10: =R[30]C[-2] -> 0 | L10: =R[39]C[-4] -> 0
A11: Name | B11: Role | C11: Date of Background ck | D11: Date of Technology Acceptable Use | E11: License # | F11: Hours per week | G11: Hours | H11: Hourly Rate | I11: Charge for Instruction
I12: =ROUND((RC[-2]*RC[-1]),2) -> 0
I13: =ROUND((RC[-2]*RC[-1]),2) -> 0
I14: =ROUND((RC[-2]*RC[-1]),2) -> 0
I15: =ROUND((RC[-2]*RC[-1]),2) -> 0 | K15: Maximum Hourly Rate
I16: =ROUND((RC[-2]*RC[-1]),2) -> 0 | K16: 39
I17: =ROUND((RC[-2]*RC[-1]),2) -> 0
I18: =ROUND((RC[-2]*RC[-1]),2) -> 0
I19: =ROUND((RC[-2]*RC[-1]),2) -> 0
I20: =ROUND((RC[-2]*RC[-1]),2) -> 0
I21: =ROUND((RC[-2]*RC[-1]),2) -> 0
I22: =ROUND((RC[-2]*RC[-1]),2) -> 0
I23: =ROUND((RC[-2]*RC[-1]),2) -> 0
I24: =ROUND((RC[-2]*RC[-1]),2) -> 0
I25: =ROUND((RC[-2]*RC[-1]),2) -> 0
I26: =ROUND((RC[-2]*RC[-1]),2) -> 0
I27: =ROUND((RC[-2]*RC[-1]),2) -> 0
I28: =ROUND((RC[-2]*RC[-1]),2) -> 0
I29: =ROUND((RC[-2]*RC[-1]),2) -> 0
I30: =ROUND((RC[-2]*RC[-1]),2) -> 0
I31: =ROUND((RC[-2]*RC[-1]),2) -> 0
I32: =ROUND((RC[-2]*RC[-1]),2) -> 0
I33: =ROUND((RC[-2]*RC[-1]),2) -> 0
I34: =ROUND((RC[-2]*RC[-1]),2) -> 0
I35: =ROUND((RC[-2]*RC[-1]),2) -> 0
I36: =ROUND((RC[-2]*RC[-1]),2) -> 0
I37: =ROUND((RC[-2]*RC[-1]),2) -> 0
I38: =ROUND((RC[-2]*RC[-1]),2) -> 0
I39: =ROUND((RC[-2]*RC[-1]),2) -> 0
A40: TOTAL INSTRUCTION COST | I40: =(SUM(R[-28]C:R[-1]C)) -> 0
A42: Counseling Calculation Detail
A43: Name | B43: Role | C43: Date of Background ck | D43: Date of Technology Acceptable Use | E43: License # | F43: Hours per week | G43: Hours | H43: Hourly Rate | I43: Charge for Counseling
I44: =ROUND((RC[-2]*RC[-1]),2) -> 0
I45: =ROUND((RC[-2]*RC[-1]),2) -> 0
I46: =ROUND((RC[-2]*RC[-1]),2) -> 0
I47: =ROUND((RC[-2]*RC[-1]),2) -> 0
I48: =ROUND((RC[-2]*RC[-1]),2) -> 0
A49: TOTAL COUNSELING CHARGES | I49: =SUM(R[-5]C:R[-1]C) -> 0
A50: ADDITIONAL EXPLANATORY NOTES:

Sheet: Example
H6: Month '16
A9: School Name | B9: School Name | J9: Total Amount Instruction | K9: Total Amount Counseling
A10: Instruction Calculation Detail | J10: =R[30]C[-2] -> 66046.079999999987 | K10: =R[37]C[-5] -> 0
A11: Name | B11: Role | C11: Date of Background ck | D11: License # | E11: FTE Status/Hours | F11: Monthly/Hourly Rate | G11: Monthly Fringe | H11: Charge for Instruction
A12: Teacher Name | B12: Teacher | C12: 2015-07-31T00:00:00.000 | D12: 616168 | E12: 1 | F12: 5543.2575999999999 | G12: 745.94 | H12: =ROUND(((RC[-3]*RC[-2])+RC[-1]),2) -> 6289.2
A13: Teacher Name | B13: Teacher | C13: 2015-07-31T00:00:00.000 | D13: 639537 | E13: 1 | F13: 5419.48 | G13: 683.78 | H13: =ROUND(((RC[-3]*RC[-2])+RC[-1]),2) -> 6103.26 | J13: FTE Status | K13: Hours/Week
A14: Teacher Name | B14: Teacher | C14: 2015-07-31T00:00:00.000 | D14: 188860 | E14: 1 | F14: 6040.1456000000007 | G14: 338.72 | H14: =ROUND(((RC[-3]*RC[-2])+RC[-1]),2) -> 6378.87 | J14: 1 | K14: 40 hours
A15: Teacher Name | B15: Teacher | C15: 2015-07-21T00:00:00.000 | D15: 725281 | E15: 1 | F15: 5852 | G15: 383.9 | H15: =ROUND(((RC[-3]*RC[-2])+RC[-1]),2) -> 6235.9 | J15: 0.875 | K15: 35 hours
A16: Teacher Name | B16: Teacher | C16: 2015-07-31T00:00:00.000 | D16: 165162 | E16: 1 | F16: 5525.6256000000003 | G16: 358.15 | H16: =ROUND(((RC[-3]*RC[-2])+RC[-1]),2) -> 5883.78 | J16: 0.5 | K16: 20 hours
A17: Teacher Name | B17: Teacher | C17: 2015-07-31T00:00:00.000 | D17: 754989 | E17: 1 | F17: 5426.4 | G17: 359.96 | H17: =ROUND(((RC[-3]*RC[-2])+RC[-1]),2) -> 5786.36 | J17: 0.2 | K17: 8 hours
A18: Teacher Name | B18: Teacher | C18: 2015-07-31T00:00:00.000 | D18: 732655 | E18: 1 | F18: 5810.81 | G18: 305.18 | H18: =ROUND(((RC[-3]*RC[-2])+RC[-1]),2) -> 6115.99 | J18: 0.125 | K18: 5 hours
A19: Teacher Name | B19: Teacher | C19: 2015-09-22T00:00:00.000 | D19: 752969 | E19: 1 | F19: 1899.24 | G19: 108.31 | H19: =ROUND(((RC[-3]*RC[-2])+RC[-1]),2) -> 2007.55 | J19: 0.1 | K19: 4 hours
A20: Teacher Name | B20: Teacher | C20: 2015-07-31T00:00:00.000 | D20: 661780 | E20: 1 | F20: 5978.0079999999998 | G20: 390.98 | H20: =ROUND(((RC[-3]*RC[-2])+RC[-1]),2) -> 6368.99
A21: Teacher Name | B21: PT Teacher | C21: 2015-07-31T00:00:00.000 | D21: 361014 | E21: 0.4 | F21: 6560 | G21: 166.89 | H21: =ROUND(((RC[-3]*RC[-2])+RC[-1]),2) -> 2790.89
J22: FTE Hourly Rate
A23: Teacher Name | B23: PT Hourly after school Teacher | C23: 2015-07-31T00:00:00.000 | D23: 361014 | E23: 1 | F23: 39 | H23: =ROUND(((RC[-3]*RC[-2])+RC[-1]),2) -> 39 | J23: 39
A27: Supervisor Name | B27: Supervisor | C27: 2015-07-31T00:00:00.000 | D27: 074150 | E27: 0.95 | F27: 8207.8799999999992 | G27: 969.08 | H27: =ROUND(((RC[-3]*RC[-2])+RC[-1]),2) -> 8766.57
A28: Supervisor Name | B28: Supervisor | C28: 2015-07-31T00:00:00.000 | D28: 122872 | E28: 0.2 | F28: 15181.7 | G28: 243.38 | H28: =ROUND(((RC[-3]*RC[-2])+RC[-1]),2) -> 3279.72
A40: TOTAL INSTRUCTION COST | H40: =(SUM(R[-28]C:R[-1]C)) -> 66046.079999999987
A42: Counseling Calculation Detail
A43: Name | B43: Role | C43: FTE status | D43: Monthly Pay | E43: Monthly Fringe | F43: Charge for Counseling
F44: =ROUND(((RC[-3]*RC[-2])+RC[-1]),2) -> 0
F45: =ROUND(((RC[-3]*RC[-2])+RC[-1]),2) -> 0
F46: =ROUND(((RC[-3]*RC[-2])+RC[-1]),2) -> 0
A47: TOTAL COUNSELING CHARGES | F47: =SUM(R[-3]C:R[-1]C) -> 0
A48: ADDITIONAL EXPLANATORY NOTES:
A49: Supervisor - Mueller 95% of Salary; Sternig 20% of salary
A50: Part Time hourly Teacher - $39 per/hr
A51: Training -

Sheet: Atlas
H6: 2019-12-01T00:00:00.000
A9: School Name | B9: Atlas Preparatory Academy | L9: Total Amount Instruction | M9: Total Amount Counseling
A10: Instruction Calculation Detail | L10: =R[17]C[-3] -> 50924.079999999987 | M10: =R[31]C[-4] -> 0
A11: Name | B11: Role | C11: Date of Background ck | D11: Date of Technology Acceptable Use | E11: License # | F11: Hours per week | G11: Hours | H11: Hourly Rate | I11: Charge for Instruction
A12: Nancy Hake | B12: Teacher | C12: 2019-06-14T00:00:00.000 | D12: 2019-08-21T00:00:00.000 | E12: 1590034133 | F12: 40 | G12: 160 | H12: 66.709999999999994 | I12: =ROUND((RC[-2]*RC[-1]),2) -> 10673.6 | L12: Maximum Hourly Rate
A13: Dawn Strasser | B13: Teacher | C13: 2019-06-14T00:00:00.000 | D13: 2019-08-21T00:00:00.000 | E13: 1001244802 | F13: 40 | G13: 160 | H13: 62.39 | I13: =ROUND((RC[-2]*RC[-1]),2) -> 9982.4 | L13: 67.069999999999993
A14: Carol Raasch | B14: Teacher | C14: 2019-06-14T00:00:00.000 | D14: 2019-08-21T00:00:00.000 | E14: 1590024357 | F14: 40 | G14: 160 | H14: 63.61 | I14: =ROUND((RC[-2]*RC[-1]),2) -> 10177.6
A15: Rebekah Beam | B15: Teacher | C15: 2019-06-14T00:00:00.000 | D15: 2019-08-21T00:00:00.000 | E15: 1590076105 | F15: =RC[1]/4 -> 40 | G15: 160 | H15: 60.03 | I15: =ROUND((RC[-2]*RC[-1]),2) -> 9604.7999999999993
A17: Jennifer Sholtes | B17: Teacher | C17: 2019-06-14T00:00:00.000 | D17: 2019-08-21T00:00:00.000 | E17: 1001309662 | F17: =RC[1]/4 -> 2 | G17: 8 | H17: 40 | I17: =ROUND((RC[-2]*RC[-1]),2) -> 320
A18: Pat Kerzman | B18: Teacher | C18: 2019-06-14T00:00:00.000 | D18: 2019-08-21T00:00:00.000 | E18: 1590017009 | F18: =RC[1]/4 -> 2 | G18: 8 | H18: 67.069999999999993 | I18: =ROUND((RC[-2]*RC[-1]),2) -> 536.55999999999995
A20: Holly Kriehn | B20: Supervisor | C20: 2019-09-23T00:00:00.000 | D20: 2019-10-17T00:00:00.000 | E20: 1001005329 | F20: 34 | G20: 80 | H20: 67.069999999999993 | I20: =ROUND((RC[-2]*RC[-1]),2) -> 5365.6
A21: Maureen Polczynski | B21: Supervisor | C21: 2019-06-14T00:00:00.000 | D21: 2019-08-21T00:00:00.000 | E21: 176099 | F21: =RC[1]/4 -> 8.4 | G21: 33.6 | H21: 34.270000000000003 | I21: =ROUND((RC[-2]*RC[-1]),2) -> 1151.47
A22: Liana Jones | B22: Supervisor | C22: 2019-06-14T00:00:00.000 | D22: 2019-08-21T00:00:00.000 | E22: 702666 | F22: =RC[1]/4 -> 8 | G22: 32 | H22: 67.069999999999993 | I22: =ROUND((RC[-2]*RC[-1]),2) -> 2146.2399999999998
A23: Ellen Sternig | B23: Supervisor | C23: 2019-06-14T00:00:00.000 | D23: 2019-08-21T00:00:00.000 | E23: 122872 | F23: =RC[1]/4 -> 3.6 | G23: 14.4 | H23: 67.069999999999993 | I23: =ROUND((RC[-2]*RC[-1]),2) -> 965.81
A27: TOTAL INSTRUCTION COST | G27: =SUM(R[-15]C:R[-1]C) -> 816 | I27: =(SUM(R[-15]C:R[-1]C)) -> 50924.079999999987
A29: Counseling Calculation Detail
A30: Name | B30: Role | C30: Date of Background ck | D30: Date of Technology Acceptable Use | E30: License # | F30: Hours per week | G30: Hours | H30: Hourly Rate | I30: Charge for Counseling
I31: =ROUND((RC[-2]*RC[-1]),2) -> 0
I32: =ROUND((RC[-2]*RC[-1]),2) -> 0
I33: =ROUND((RC[-2]*RC[-1]),2) -> 0
I34: =ROUND((RC[-2]*RC[-1]),2) -> 0
I35: =ROUND((RC[-2]*RC[-1]),2) -> 0
I36: =ROUND((RC[-2]*RC[-1]),2) -> 0
I37: =ROUND((RC[-2]*RC[-1]),2) -> 0
I38: =ROUND((RC[-2]*RC[-1]),2) -> 0
I39: =ROUND((RC[-2]*RC[-1]),2) -> 0
I40: =ROUND((RC[-2]*RC[-1]),2) -> 0
A41: TOTAL COUNSELING CHARGES | I41: =SUM(R[-10]C:R[-1]C) -> 0
A42: ADDITIONAL EXPLANATORY NOTES:
A43: 12/20- TA Nancy Hake out, P. Kertzman Subbed 12/23-12/31 SC Winter Break

Sheet: Christ King
G6: 2019-12-01T00:00:00.000
A9: School Name | B9: Christ King | L9: Total Amount Instruction | M9: Total Amount Counseling
A10: Instruction Calculation Detail | L10: =R[32]C[-3] -> 354.83 | M10: =R[46]C[-4] -> 0
A11: Name | B11: Role | C11: Date of Background ck | D11: Date of Technology Acceptable Use | E11: License # | F11: Hours per week | G11: Hours | H11: Hourly Rate | I11: Charge for Instruction
A12: Katie Dahm | B12: After school teacher | C12: 2019-10-02T00:00:00.000 | D12: 2019-10-02T00:00:00.000 | E12: 1590075604 | F12: =RC[1]/4 -> 1.25 | G12: 5 | H12: 60 | I12: =ROUND((RC[-2]*RC[-1]),2) -> 300 | L12: Maximum Hourly Rate
I13: =ROUND((RC[-2]*RC[-1]),2) -> 0 | L13: 67.069999999999993
I14: =ROUND((RC[-2]*RC[-1]),2) -> 0
I15: =ROUND((RC[-2]*RC[-1]),2) -> 0
I16: =ROUND((RC[-2]*RC[-1]),2) -> 0
I17: =ROUND((RC[-2]*RC[-1]),2) -> 0
I18: =ROUND((RC[-2]*RC[-1]),2) -> 0
I19: =ROUND((RC[-2]*RC[-1]),2) -> 0
I20: =ROUND((RC[-2]*RC[-1]),2) -> 0
I21: =ROUND((RC[-2]*RC[-1]),2) -> 0
I22: =ROUND((RC[-2]*RC[-1]),2) -> 0
I23: =ROUND((RC[-2]*RC[-1]),2) -> 0
A24: Maureen Polczynski | B24: Supervisor | C24: 2019-06-14T00:00:00.000 | D24: 2019-08-21T00:00:00.000 | E24: 176099 | F24: =RC[1]/4 -> 0.4 | G24: 1.6 | H24: 34.270000000000003 | I24: =ROUND((RC[-2]*RC[-1]),2) -> 54.83
I25: =ROUND((RC[-2]*RC[-1]),2) -> 0
I26: =ROUND((RC[-2]*RC[-1]),2) -> 0
I27: =ROUND((RC[-2]*RC[-1]),2) -> 0
I28: =ROUND((RC[-2]*RC[-1]),2) -> 0
I29: =ROUND((RC[-2]*RC[-1]),2) -> 0
I30: =ROUND((RC[-2]*RC[-1]),2) -> 0
I31: =ROUND((RC[-2]*RC[-1]),2) -> 0
I32: =ROUND((RC[-2]*RC[-1]),2) -> 0
I33: =ROUND((RC[-2]*RC[-1]),2) -> 0
I34: =ROUND((RC[-2]*RC[-1]),2) -> 0
I35: =ROUND((RC[-2]*RC[-1]),2) -> 0
I36: =ROUND((RC[-2]*RC[-1]),2) -> 0
I37: =ROUND((RC[-2]*RC[-1]),2) -> 0
I38: =ROUND((RC[-2]*RC[-1]),2) -> 0
I39: =ROUND((RC[-2]*RC[-1]),2) -> 0
I40: =ROUND((RC[-2]*RC[-1]),2) -> 0
I41: =ROUND((RC[-2]*RC[-1]),2) -> 0
A42: TOTAL INSTRUCTION COST | G42: =SUM(R[-30]C:R[-1]C) -> 6.6 | I42: =(SUM(R[-30]C:R[-1]C)) -> 354.83
A44: Counseling Calculation Detail
A45: Name | B45: Role | C45: Date of Background ck | D45: Date of Technology Acceptable Use | E45: License # | F45: Hours per week | G45: Hours | H45: Hourly Rate | I45: Charge for Counseling
I46: =ROUND((RC[-2]*RC[-1]),2) -> 0
I47: =ROUND((RC[-2]*RC[-1]),2) -> 0
I48: =ROUND((RC[-2]*RC[-1]),2) -> 0
I49: =ROUND((RC[-2]*RC[-1]),2) -> 0
I50: =ROUND((RC[-2]*RC[-1]),2) -> 0
I51: =ROUND((RC[-2]*RC[-1]),2) -> 0
I52: =ROUND((RC[-2]*RC[-1]),2) -> 0
I53: =ROUND((RC[-2]*RC[-1]),2) -> 0
I54: =ROUND((RC[-2]*RC[-1]),2) -> 0
I55: =ROUND((RC[-2]*RC[-1]),2) -> 0
A56: TOTAL COUNSELING CHARGES | I56: =SUM(R[-10]C:R[-1]C) -> 0
A57: ADDITIONAL EXPLANATORY NOTES:
A58: 12/23-12/31 SC Christmas Break

Sheet: City School
H6: 2019-12-01T00:00:00.000
A9: School Name | B9: City School | L9: Total Amount Instruction | M9: Total Amount Counseling
A10: Instruction Calculation Detail | L10: =R[32]C[-3] -> 17682.04 | M10: =R[46]C[-4] -> 0
A11: Name | B11: Role | C11: Date of Background ck | D11: Date of Technology Acceptable Use | E11: License # | F11: Hours per week | G11: Hours | H11: Hourly Rate | I11: Charge for Instruction
A12: Sonja Pavlik | B12: Teacher | C12: 2019-06-14T00:00:00.000 | D12: 2019-08-21T00:00:00.000 | E12: 1590053159 | F12: =RC[1]/4 -> 24 | G12: 96 | H12: 43 | I12: =ROUND((RC[-2]*RC[-1]),2) -> 4128 | J12: =SUM(RC[-1]:R[1]C[-1]) -> 12661 | L12: Maximum Hourly Rate
A13: Jodi Hockerman | B13: Teacher | F13: =RC[1]/4 -> 35 | G13: 140 | H13: 60.95 | I13: =ROUND((RC[-2]*RC[-1]),2) -> 8533 | L13: 67.069999999999993
A16: Suzanne Hurst | B16: Teacher | C16: 2019-06-14T00:00:00.000 | D16: 2019-08-21T00:00:00.000 | E16: 1590001127 | F16: =RC[1]/4 -> 3.5 | G16: 14 | H16: 26.86 | I16: =ROUND((RC[-2]*RC[-1]),2) -> 376.04
A17: Rachel Plakut | B17: Teacher | C17: 2019-06-14T00:00:00.000 | D17: 2019-08-21T00:00:00.000 | E17: 1590075508 | F17: =RC[1]/4 -> 10 | G17: 40 | H17: 65.11 | I17: =ROUND((RC[-2]*RC[-1]),2) -> 2604.4
A18: Teresa Mueller | B18: Teacher | C18: 2019-06-14T00:00:00.000 | D18: 2019-08-21T00:00:00.000 | E18: 1590005537 | F18: =RC[1]/4 -> 8 | G18: 32 | H18: 53.06 | I18: =ROUND((RC[-2]*RC[-1]),2) -> 1697.92
A19: Thomas Giesen | B19: Teacher | C19: 2019-06-14T00:00:00.000 | D19: 2019-08-21T00:00:00.000 | E19: 1601020928 | F19: =RC[1]/4 -> 0.625 | G19: 2.5 | H19: 62.32 | I19: =ROUND((RC[-2]*RC[-1]),2) -> 155.80000000000001
A24: Jane Haessly | B24: Supervisor | C24: 43630 | D24: 2019-08-21T00:00:00.000 | E24: 043900 | F24: 0.8 | G24: 3.2 | H24: 58.4 | I24: 186.88
A42: TOTAL INSTRUCTION COST | G42: =SUM(R[-30]C:R[-1]C) -> 327.7 | I42: =(SUM(R[-30]C:R[-1]C)) -> 17682.04
A44: Counseling Calculation Detail
A45: Name | B45: Role | C45: Date of Background ck | D45: Date of Technology Acceptable Use | E45: License # | F45: Hours per week | G45: Hours | H45: Hourly Rate | I45: Charge for Counseling
I46: =ROUND((RC[-2]*RC[-1]),2) -> 0
I47: =ROUND((RC[-2]*RC[-1]),2) -> 0
I48: =ROUND((RC[-2]*RC[-1]),2) -> 0
I49: =ROUND((RC[-2]*RC[-1]),2) -> 0
I50: =ROUND((RC[-2]*RC[-1]),2) -> 0
I51: =ROUND((RC[-2]*RC[-1]),2) -> 0
I52: =ROUND((RC[-2]*RC[-1]),2) -> 0
I53: =ROUND((RC[-2]*RC[-1]),2) -> 0
I54: =ROUND((RC[-2]*RC[-1]),2) -> 0
I55: =ROUND((RC[-2]*RC[-1]),2) -> 0
A56: TOTAL COUNSELING CHARGES | I56: =SUM(R[-10]C:R[-1]C) -> 0
A57: ADDITIONAL EXPLANATORY NOTES:
A58: (open math position) 12/2-12/3 Sub Pat Kertzman/Tom Giesen, 12/4 Sub Suzanne Hurst, 12/5 Sub Rachel Geislinger, 12/6 TA:No Sub , 12/9 Sub Pat Kertzman (AM), School closed PM/half day, 12/10 Sub Jen Sholtes (till 1pm went home sick, last group canceled), 12/11 Sub Suzanne Hurst, 12/12 Sub Rachel Geislinger and TA: Sub Teresa Mueller, 12/13 No Sub available, 12/16 Sub Pat Kertzman/Tom Giesen, 12/17 Sub Teresa Mueller, 12/18 Sub Teresa Mueller, 12/19 Sub Rachel Geislinger

Sheet: Cross Trainers
H6: 2019-12-01T00:00:00.000
A9: School Name | B9: Cross Trainers | L9: Total Amount Instruction | M9: Total Amount Counseling
A10: Instruction Calculation Detail | L10: =R[14]C[-3] -> 29229.66 | M10: =R[28]C[-4] -> 0
A11: Name | B11: Role | C11: Date of Background ck | D11: Date of Technology Acceptable Use | E11: License # | F11: Hours per week | G11: Hours | H11: Hourly Rate | I11: Charge for Instruction
A12: Janet Boehlke | B12: Teacher | C12: 2019-06-14T00:00:00.000 | D12: 2019-08-21T00:00:00.000 | E12: 1590056097 | F12: =RC[1]/4 -> 40 | G12: 160 | H12: 67.069999999999993 | I12: =ROUND((RC[-2]*RC[-1]),2) -> 10731.2 | J12: =SUM(RC[-1]:R[1]C[-1]) -> 21462.400000000001 | L12: Maximum Hourly Rate
A13: Susan arends | B13: Teacher | C13: 2019-06-27T00:00:00.000 | D13: 2019-08-21T00:00:00.000 | E13: 1590018785 | F13: =RC[1]/4 -> 40 | G13: 160 | H13: 67.069999999999993 | I13: =ROUND((RC[-2]*RC[-1]),2) -> 10731.2 | L13: 67.069999999999993
A15: Possible new teacher | F15: 16 | G15: 64 | H15: 43 | I15: =ROUND((RC[-2]*RC[-1]),2) -> 2752
A16: Jennifer Sholtes | B16: Teacher | C16: 2019-06-14T00:00:00.000 | D16: 2019-08-21T00:00:00.000 | E16: 1001309662 | F16: =RC[1]/4 -> 2 | G16: 8 | H16: 40 | I16: =ROUND((RC[-2]*RC[-1]),2) -> 320
A17: Teresa Mueller | B17: Teacher | C17: 2019-06-14T00:00:00.000 | D17: 2019-08-21T00:00:00.000 | E17: 1590005537 | F17: =RC[1]/4 -> 6 | G17: 24 | H17: 53.06 | I17: =ROUND((RC[-2]*RC[-1]),2) -> 1273.44
A19: Cassie Theobald | B19: Supervisor | C19: 2019-06-14T00:00:00.000 | D19: 2019-08-21T00:00:00.000 | E19: 1590019859 | F19: =RC[1]/4 -> 1.6 | G19: 6.4 | H19: 64.88 | I19: =ROUND((RC[-2]*RC[-1]),2) -> 415.23
A20: Jane Haessly | B20: Supervisor | C20: 2019-06-14T00:00:00.000 | D20: 2019-08-21T00:00:00.000 | E20: 1590004207 | F20: 40 | G20: 25.6 | H20: 58.4 | I20: =ROUND((RC[-2]*RC[-1]),2) -> 1495.04
A21: Maureen Polczynski | B21: Supervisor | C21: 2019-06-14T00:00:00.000 | D21: 2019-08-21T00:00:00.000 | E21: 176099 | F21: =RC[1]/4 -> 0.8 | G21: 3.2 | H21: 34.270000000000003 | I21: =ROUND((RC[-2]*RC[-1]),2) -> 109.66
A22: Jennifer Hockett | B22: Supervisor | C22: 2019-06-14T00:00:00.000 | D22: 2019-08-21T00:00:00.000 | E22: 1590039078 | F22: =RC[1]/4 -> 4 | G22: 16 | H22: 60.79 | I22: =ROUND((RC[-2]*RC[-1]),2) -> 972.64
A23: Robin Buboltz | B23: Supervisor | C23: 2019-06-14T00:00:00.000 | D23: 2019-08-21T00:00:00.000 | E23: 1590066648 | F23: =RC[1]/4 -> 1.6 | G23: 6.4 | H23: 67.069999999999993 | I23: =ROUND((RC[-2]*RC[-1]),2) -> 429.25
A24: TOTAL INSTRUCTION COST | G24: =SUM(R[-12]C:R[-1]C) -> 473.59999999999997 | I24: =(SUM(R[-12]C:R[-1]C)) -> 29229.66
A26: Counseling Calculation Detail
A27: Name | B27: Role | C27: Date of Background ck | D27: Date of Technology Acceptable Use | E27: License # | F27: Hours per week | G27: Hours | H27: Hourly Rate | I27: Charge for Counseling
I28: =ROUND((RC[-2]*RC[-1]),2) -> 0
I29: =ROUND((RC[-2]*RC[-1]),2) -> 0
I30: =ROUND((RC[-2]*RC[-1]),2) -> 0
I31: =ROUND((RC[-2]*RC[-1]),2) -> 0
I32: =ROUND((RC[-2]*RC[-1]),2) -> 0
I33: =ROUND((RC[-2]*RC[-1]),2) -> 0
I34: =ROUND((RC[-2]*RC[-1]),2) -> 0
I35: =ROUND((RC[-2]*RC[-1]),2) -> 0
I36: =ROUND((RC[-2]*RC[-1]),2) -> 0
I37: =ROUND((RC[-2]*RC[-1]),2) -> 0
A38: TOTAL COUNSELING CHARGES | I38: =SUM(R[-10]C:R[-1]C) -> 0
A39: ADDITIONAL EXPLANATORY NOTES:
A40: 12/4 - J. Boehlke out 1/2 day (PM) No sub available. 12/23-12/31 SC Winter Break

Sheet: Elm Grove
H6: 2019-12-01T00:00:00.000
A9: School Name | B9: Elm Grove | L9: Total Amount Instruction | M9: Total Amount Counseling
A10: Instruction Calculation Detail | L10: =R[16]C[-3] -> 0 | M10: =R[30]C[-4] -> 0
A11: Name | B11: Role | C11: Date of Background ck | D11: Date of Technology Acceptable Use | E11: License # | F11: Hours per week | G11: Hours | H11: Hourly Rate | I11: Charge for Instruction
A12: Kate Schmidt | B12: Teacher | C12: 2019-06-14T00:00:00.000 | D12: 2019-08-21T00:00:00.000 | E12: 1001095920 | F12: =RC[1]/4 -> 0 | G12: 0 | H12: 37 | I12: =ROUND((RC[-2]*RC[-1]),2) -> 0 | L12: Maximum Hourly Rate
L13: 67.069999999999993
A14: Rachel Plakut | B14: Teacher | C14: 2019-06-14T00:00:00.000 | D14: 2019-08-21T00:00:00.000 | E14: 1590075508 | F14: =RC[1]/4 -> 0 | G14: 0 | H14: 65.11 | I14: =ROUND((RC[-2]*RC[-1]),2) -> 0
A25: Maureen Polczynski | B25: Supervisor | C25: 2019-06-14T00:00:00.000 | D25: 2019-08-21T00:00:00.000 | E25: 176099 | F25: =RC[1]/4 -> 0 | G25: 0 | H25: 34.270000000000003 | I25: =ROUND((RC[-2]*RC[-1]),2) -> 0
A26: TOTAL INSTRUCTION COST | G26: =SUM(R[-14]C:R[-1]C) -> 0 | I26: =(SUM(R[-14]C:R[-1]C)) -> 0
A28: Counseling Calculation Detail
A29: Name | B29: Role | C29: Date of Background ck | D29: Date of Technology Acceptable Use | E29: License # | F29: Hours per week | G29: Hours | H29: Hourly Rate | I29: Charge for Counseling
I30: =ROUND((RC[-2]*RC[-1]),2) -> 0
I31: =ROUND((RC[-2]*RC[-1]),2) -> 0
I32: =ROUND((RC[-2]*RC[-1]),2) -> 0
I33: =ROUND((RC[-2]*RC[-1]),2) -> 0
I34: =ROUND((RC[-2]*RC[-1]),2) -> 0
I35: =ROUND((RC[-2]*RC[-1]),2) -> 0
I36: =ROUND((RC[-2]*RC[-1]),2) -> 0
I37: =ROUND((RC[-2]*RC[-1]),2) -> 0
I38: =ROUND((RC[-2]*RC[-1]),2) -> 0
I39: =ROUND((RC[-2]*RC[-1]),2) -> 0
A40: TOTAL COUNSELING CHARGES | I40: =SUM(R[-10]C:R[-1]C) -> 0
A41: ADDITIONAL EXPLANATORY NOTES:
A42: Title services on hold until Feb.

Sheet: El Puente
H6: 2019-12-01T00:00:00.000
A9: School Name | B9: El Puente | L9: Total Amount Instruction | M9: Total Amount Counseling
A10: Instruction Calculation Detail | L10: =R[10]C[-3] -> 6672.7000000000007 | M10: =R[24]C[-4] -> 0
A11: Name | B11: Role | C11: Date of Background ck | D11: Date of Technology Acceptable Use | E11: License # | F11: Hours per week | G11: Hours | H11: Hourly Rate | I11: Charge for Instruction
A12: Cheri Woelfl | B12: Teacher | C12: 2019-06-14T00:00:00.000 | D12: 2019-08-21T00:00:00.000 | E12: 1590074030 | F12: =RC[1]/4 -> 28 | G12: 112 | H12: 58.13 | I12: =ROUND((RC[-2]*RC[-1]),2) -> 6510.56 | L12: Maximum Hourly Rate
L13: 67.069999999999993
A18: Maureen Polczynski | B18: Supervisor | C18: 2019-06-14T00:00:00.000 | D18: 2019-08-21T00:00:00.000 | E18: 176099 | F18: =RC[1]/4 -> 0.4 | G18: 1.6 | H18: 34.270000000000003 | I18: =ROUND((RC[-2]*RC[-1]),2) -> 54.83
A19: Robin Buboltz | B19: Supervisor | C19: 2019-06-14T00:00:00.000 | D19: 2019-08-21T00:00:00.000 | E19: 1590066648 | F19: =RC[1]/4 -> 0.4 | G19: 1.6 | H19: 67.069999999999993 | I19: =ROUND((RC[-2]*RC[-1]),2) -> 107.31
A20: TOTAL INSTRUCTION COST | G20: =SUM(R[-8]C:R[-1]C) -> 115.19999999999999 | I20: =(SUM(R[-8]C:R[-1]C)) -> 6672.7000000000007
A22: Counseling Calculation Detail
A23: Name | B23: Role | C23: Date of Background ck | D23: Date of Technology Acceptable Use | E23: License # | F23: Hours per week | G23: Hours | H23: Hourly Rate | I23: Charge for Counseling
I24: =ROUND((RC[-2]*RC[-1]),2) -> 0
I25: =ROUND((RC[-2]*RC[-1]),2) -> 0
I26: =ROUND((RC[-2]*RC[-1]),2) -> 0
I27: =ROUND((RC[-2]*RC[-1]),2) -> 0
I28: =ROUND((RC[-2]*RC[-1]),2) -> 0
I29: =ROUND((RC[-2]*RC[-1]),2) -> 0
I30: =ROUND((RC[-2]*RC[-1]),2) -> 0
I31: =ROUND((RC[-2]*RC[-1]),2) -> 0
I32: =ROUND((RC[-2]*RC[-1]),2) -> 0
I33: =ROUND((RC[-2]*RC[-1]),2) -> 0
A34: TOTAL COUNSELING CHARGES | I34: =SUM(R[-10]C:R[-1]C) -> 0
A35: ADDITIONAL EXPLANATORY NOTES:
A36: 12/6 SC PD Day; 12/18-12/19 SF Exams;12/23-12/31 SC Winter Intersession

Sheet: Grace Christian
H6: 2019-12-01T00:00:00.000
A9: School Name | B9: Grace Christian | L9: Total Amount Instruction | M9: Total Amount Counseling
A10: Instruction Calculation Detail | L10: =R[11]C[-3] -> 4159.04 | M10: =R[25]C[-4] -> 0
A11: Name | B11: Role | C11: Date of Background ck | D11: Date of Technology Acceptable Use | E11: License # | F11: Hours per week | G11: Hours | H11: Hourly Rate | I11: Charge for Instruction
A12: Jennifer Sholtes | B12: Teacher | C12: 2019-06-14T00:00:00.000 | D12: 2019-08-21T00:00:00.000 | E12: 1015905915 | F12: =RC[1]/4 -> 24 | G12: 96 | H12: 42.35 | I12: =ROUND((RC[-2]*RC[-1]),2) -> 4065.6 | L12: Maximum Hourly Rate
L13: 67.069999999999993
A20: Jane Haessly | B20: Supervisor | C20: 2019-06-14T00:00:00.000 | D20: 2019-08-21T00:00:00.000 | E20: 1590004207 | F20: 40 | G20: 1.6 | H20: 58.4 | I20: =ROUND((RC[-2]*RC[-1]),2) -> 93.44
A21: TOTAL INSTRUCTION COST | G21: =SUM(R[-9]C:R[-1]C) -> 97.6 | I21: =(SUM(R[-9]C:R[-1]C)) -> 4159.04
A23: Counseling Calculation Detail
A24: Name | B24: Role | C24: Date of Background ck | D24: Date of Technology Acceptable Use | E24: License # | F24: Hours per week | G24: Hours | H24: Hourly Rate | I24: Charge for Counseling
I25: =ROUND((RC[-2]*RC[-1]),2) -> 0
I26: =ROUND((RC[-2]*RC[-1]),2) -> 0
I27: =ROUND((RC[-2]*RC[-1]),2) -> 0
I28: =ROUND((RC[-2]*RC[-1]),2) -> 0
I29: =ROUND((RC[-2]*RC[-1]),2) -> 0
I30: =ROUND((RC[-2]*RC[-1]),2) -> 0
I31: =ROUND((RC[-2]*RC[-1]),2) -> 0
I32: =ROUND((RC[-2]*RC[-1]),2) -> 0
I33: =ROUND((RC[-2]*RC[-1]),2) -> 0
I34: =ROUND((RC[-2]*RC[-1]),2) -> 0
A35: TOTAL COUNSELING CHARGES | I35: =SUM(R[-10]C:R[-1]C) -> 0
A36: ADDITIONAL EXPLANATORY NOTES:
A37: 12/9 TA- No sub, 12/13 TA: No Sub, 12/23-12/31 - SC: Winter Break

Sheet: Hope Caritas
H6: 2019-12-01T00:00:00.000
A9: School Name | B9: Hope Caritas | L9: Total Amount Instruction | M9: Total Amount Counseling
A10: Instruction Calculation Detail | L10: =R[14]C[-3] -> 29954.32 | M10: =R[28]C[-4] -> 0
A11: Name | B11: Role | C11: Date of Background ck | D11: Date of Technology Acceptable Use | E11: License # | F11: Hours per week | G11: Hours | H11: Hourly Rate | I11: Charge for Instruction
A12: Jackie Winston | B12: Teacher | C12: 2019-06-19T00:00:00.000 | D12: 2019-08-21T00:00:00.000 | E12: 1590000899 | F12: 40 | G12: 160 | H12: 67.069999999999993 | I12: =ROUND((RC[-2]*RC[-1]),2) -> 10731.2 | L12: Maximum Hourly Rate
A13: Julie Joll | B13: Teacher | C13: 2019-06-14T00:00:00.000 | D13: 2019-08-21T00:00:00.000 | E13: 1590017530 | F13: =RC[1]/4 -> 40 | G13: 160 | H13: 67.069999999999993 | I13: =ROUND((RC[-2]*RC[-1]),2) -> 10731.2
F15: =RC[1]/4 -> 24 | G15: 96 | H15: 43 | I15: =ROUND((RC[-2]*RC[-1]),2) -> 4128
A17: Heidi Egner | B17: Supervisor | C17: 2019-06-14T00:00:00.000 | D17: 2019-08-21T00:00:00.000 | E17: 1590039829 | F17: =RC[1]/4 -> 3.6 | G17: 14.4 | H17: 64.819999999999993 | I17: =ROUND((RC[-2]*RC[-1]),2) -> 933.41
A18: Robin Buboltz | B18: Supervisor | C18: 2019-06-14T00:00:00.000 | D18: 2019-08-21T00:00:00.000 | E18: 1590066648 | F18: =RC[1]/4 -> 1.6 | G18: 6.4 | H18: 67.069999999999993 | I18: =ROUND((RC[-2]*RC[-1]),2) -> 429.25
A19: Cassie Theobald | B19: Supervisor | C19: 2019-06-14T00:00:00.000 | D19: 2019-08-21T00:00:00.000 | E19: 1590019859 | F19: =RC[1]/4 -> 0.8 | G19: 3.2 | H19: 64.88 | I19: =ROUND((RC[-2]*RC[-1]),2) -> 207.62
A20: Joelle Amberg | B20: Supervisor | C20: 2019-06-14T00:00:00.000 | D20: 2019-08-21T00:00:00.000 | E20: 1590047303 | F20: =RC[1]/4 -> 6 | G20: 24 | H20: 67.069999999999993 | I20: =ROUND((RC[-2]*RC[-1]),2) -> 1609.68
A21: Liana Jones | B21: Supervisor | C21: 2019-06-14T00:00:00.000 | D21: 2019-08-21T00:00:00.000 | E21: 1590059525 | F21: =RC[1]/4 -> 3 | G21: 12 | H21: 67.069999999999993 | I21: =ROUND((RC[-2]*RC[-1]),2) -> 804.84
A22: Maureen Polczynski | B22: Supervisor | C22: 2019-06-14T00:00:00.000 | D22: 2019-08-21T00:00:00.000 | E22: 176099 | F22: =RC[1]/4 -> 1.2 | G22: 4.8 | H22: 34.270000000000003 | I22: =ROUND((RC[-2]*RC[-1]),2) -> 164.5
A23: Ellen Sternig | B23: Supervisor | C23: 2019-06-14T00:00:00.000 | D23: 2019-08-21T00:00:00.000 | E23: 2800004552 | F23: =RC[1]/4 -> 0.8 | G23: 3.2 | H23: 67.069999999999993 | I23: =ROUND((RC[-2]*RC[-1]),2) -> 214.62
A24: TOTAL INSTRUCTION COST | G24: =SUM(R[-12]C:R[-1]C) -> 483.99999999999994 | I24: =(SUM(R[-12]C:R[-1]C)) -> 29954.32
A26: Counseling Calculation Detail
A27: Name | B27: Role | C27: Date of Background ck | D27: Date of Technology Acceptable Use | E27: License # | F27: Hours per week | G27: Hours | H27: Hourly Rate | I27: Charge for Counseling
I28: =ROUND((RC[-2]*RC[-1]),2) -> 0
I29: =ROUND((RC[-2]*RC[-1]),2) -> 0
I30: =ROUND((RC[-2]*RC[-1]),2) -> 0
I31: =ROUND((RC[-2]*RC[-1]),2) -> 0
I32: =ROUND((RC[-2]*RC[-1]),2) -> 0
I33: =ROUND((RC[-2]*RC[-1]),2) -> 0
I34: =ROUND((RC[-2]*RC[-1]),2) -> 0
I35: =ROUND((RC[-2]*RC[-1]),2) -> 0
I36: =ROUND((RC[-2]*RC[-1]),2) -> 0
I37: =ROUND((RC[-2]*RC[-1]),2) -> 0
A38: TOTAL COUNSELING CHARGES | I38: =SUM(R[-10]C:R[-1]C) -> 0
A39: ADDITIONAL EXPLANATORY NOTES:
A40: 12/13 SC Teacher Data Day; 12/23-12/31 SC Winter Break

Sheet: Hope Fidelis
H6: 2019-12-01T00:00:00.000
A9: School Name | B9: Hope Fidelis | L9: Total Amount Instruction | M9: Total Amount Counseling
A10: Instruction Calculation Detail | L10: =R[14]C[-3] -> 21405.439999999995 | M10: =R[28]C[-4] -> 0
A11: Name | B11: Role | C11: Date of Background ck | D11: Date of Technology Acceptable Use | E11: License # | F11: Hours per week | G11: Hours | H11: Hourly Rate | I11: Charge for Instruction
A12: Laurel Hartke | B12: Teacher | C12: 2019-06-14T00:00:00.000 | D12: 2019-08-21T00:00:00.000 | E12: 1015913935 | F12: 40 | G12: 128 | H12: 67.069999999999993 | I12: =ROUND((RC[-2]*RC[-1]),2) -> 8584.9599999999991 | L12: Maximum Hourly Rate
L13: 67.069999999999993
A15: Kate Strassman | B15: Teacher | C15: 2019-06-14T00:00:00.000 | D15: 2019-08-21T00:00:00.000 | E15: 1015905887 | F15: =RC[1]/4 -> 36 | G15: 144 | H15: 64.680000000000007 | I15: =ROUND((RC[-2]*RC[-1]),2) -> 9313.92
A16: Pat Kerzman | B16: Teacher | C16: 2019-06-14T00:00:00.000 | D16: 2019-08-21T00:00:00.000 | E16: 1590017009 | F16: =RC[1]/4 -> 1 | G16: 4 | H16: 67.069999999999993 | I16: =ROUND((RC[-2]*RC[-1]),2) -> 268.27999999999997
A18: Jane Haessly | B18: Supervisor | C18: 2019-06-14T00:00:00.000 | D18: 2019-08-21T00:00:00.000 | E18: 1590004207 | F18: 40 | G18: 3.2 | H18: 58.4 | I18: =ROUND((RC[-2]*RC[-1]),2) -> 186.88
A19: Robin Buboltz | B19: Supervisor | C19: 2019-06-14T00:00:00.000 | D19: 2019-08-21T00:00:00.000 | E19: 1590066648 | F19: =RC[1]/4 -> 0.4 | G19: 1.6 | H19: 67.069999999999993 | I19: =ROUND((RC[-2]*RC[-1]),2) -> 107.31
A20: Patricia Blaszczyk | B20: Supervisor | C20: 2019-06-14T00:00:00.000 | D20: 2019-08-21T00:00:00.000 | E20: 2590003596 | F20: =RC[1]/4 -> 6.8 | G20: 27.2 | H20: 62.09 | I20: =ROUND((RC[-2]*RC[-1]),2) -> 1688.85
A21: Heidi Egner | B21: Supervisor | C21: 2019-06-14T00:00:00.000 | D21: 2019-08-21T00:00:00.000 | E21: 1590039829 | F21: =RC[1]/4 -> 1.2 | G21: 4.8 | H21: 64.819999999999993 | I21: =ROUND((RC[-2]*RC[-1]),2) -> 311.14
A22: Jennifer Hockett | B22: Supervisor | C22: 2019-06-14T00:00:00.000 | D22: 2019-08-21T00:00:00.000 | E22: 1590039078 | F22: =RC[1]/4 -> 3 | G22: 12 | H22: 60.79 | I22: =ROUND((RC[-2]*RC[-1]),2) -> 729.48
A23: Joelle Amberg | B23: Supervisor | C23: 2019-06-14T00:00:00.000 | D23: 2019-08-21T00:00:00.000 | E23: 1590047303 | F23: =RC[1]/4 -> 0.8 | G23: 3.2 | H23: 67.069999999999993 | I23: =ROUND((RC[-2]*RC[-1]),2) -> 214.62
A24: TOTAL INSTRUCTION COST | G24: =SUM(R[-12]C:R[-1]C) -> 328 | I24: =(SUM(R[-12]C:R[-1]C)) -> 21405.439999999995
A26: Counseling Calculation Detail
A27: Name | B27: Role | C27: Date of Background ck | D27: Date of Technology Acceptable Use | E27: License # | F27: Hours per week | G27: Hours | H27: Hourly Rate | I27: Charge for Counseling
I28: =ROUND((RC[-2]*RC[-1]),2) -> 0
I29: =ROUND((RC[-2]*RC[-1]),2) -> 0
I30: =ROUND((RC[-2]*RC[-1]),2) -> 0
I31: =ROUND((RC[-2]*RC[-1]),2) -> 0
I32: =ROUND((RC[-2]*RC[-1]),2) -> 0
I33: =ROUND((RC[-2]*RC[-1]),2) -> 0
I34: =ROUND((RC[-2]*RC[-1]),2) -> 0
I35: =ROUND((RC[-2]*RC[-1]),2) -> 0
I36: =ROUND((RC[-2]*RC[-1]),2) -> 0
I37: =ROUND((RC[-2]*RC[-1]),2) -> 0
A38: TOTAL COUNSELING CHARGES | I38: =SUM(R[-10]C:R[-1]C) -> 0
A39: ADDITIONAL EXPLANATORY NOTES:
A40: 12/2/2019-12/20/2019 Laural Hartke on maternity leave-Kate Strassman subs, 12/3/2019 Lisa Patterson out--no sub available--classes cancelled 12/4/2019 Lisa Patterson out--no sub available--classes cancelled, 12/13 SC Teacher Data Day; 12/23-12/31 SC Winter Break

Sheet: Hope Fortis
I6: 2019-12-01T00:00:00.000
A9: School Name | B9: Hope Fortis | L9: Total Amount Instruction | M9: Total Amount Counseling
A10: Instruction Calculation Detail | L10: =R[20]C[-3] -> 30759.520000000004 | M10: =R[34]C[-4] -> 0
A11: Name | B11: Role | C11: Date of Background ck | D11: Date of Technology Acceptable Use | E11: License # | F11: Hours per week | G11: Hours | H11: Hourly Rate | I11: Charge for Instruction
A12: Heidi Hilby | B12: Teacher | C12: 2019-07-30T00:00:00.000 | D12: 2019-08-21T00:00:00.000 | E12: 2590001619 | F12: 40 | G12: 160 | H12: 67.069999999999993 | I12: =ROUND((RC[-2]*RC[-1]),2) -> 10731.2 | L12: Maximum Hourly Rate
L13: 67.069999999999993
A15: Thomas Giesen | B15: Teacher | C15: 2019-06-14T00:00:00.000 | D15: 2019-08-21T00:00:00.000 | E15: 1601020928 | F15: =RC[1]/4 -> 0.875 | G15: 3.5 | H15: 62.32 | I15: =ROUND((RC[-2]*RC[-1]),2) -> 218.12
A21: Maureen Mueller | B21: Supervisor | C21: 2019-06-14T00:00:00.000 | D21: 2019-08-21T00:00:00.000 | E21: 1590015250 | F21: =RC[1]/4 -> 0.4 | G21: 1.6 | H21: 67.069999999999993 | I21: =ROUND((RC[-2]*RC[-1]),2) -> 107.31
A22: Sue Biehn | B22: Supervisor | C22: 2019-06-14T00:00:00.000 | D22: 2019-08-21T00:00:00.000 | E22: 1590057967 | F22: =RC[1]/4 -> 20 | G22: 80 | H22: 67.069999999999993 | I22: =ROUND((RC[-2]*RC[-1]),2) -> 5365.6
A23: Pattie Blaszczyk | B23: Supervisor | C23: 2019-06-14T00:00:00.000 | D23: 2019-08-21T00:00:00.000 | E23: 2590003596 | F23: =RC[1]/4 -> 13.2 | G23: 52.8 | H23: 62.09 | I23: =ROUND((RC[-2]*RC[-1]),2) -> 3278.35
A24: Robin Buboltz | B24: Supervisor | C24: 2019-06-14T00:00:00.000 | D24: 2019-08-21T00:00:00.000 | E24: 1590066648 | F24: =RC[1]/4 -> 3.6 | G24: 14.4 | H24: 67.069999999999993 | I24: =ROUND((RC[-2]*RC[-1]),2) -> 965.81
A25: Ellen Sternig | B25: Supervisor | C25: 2019-06-14T00:00:00.000 | D25: 2019-08-21T00:00:00.000 | E25: 2800004552 | F25: =RC[1]/4 -> 18 | G25: 72 | H25: 67.069999999999993 | I25: =ROUND((RC[-2]*RC[-1]),2) -> 4829.04
A26: Jane Haessly | B26: Supervisor | C26: 2019-06-14T00:00:00.000 | D26: 2019-08-21T00:00:00.000 | E26: 1590004207 | F26: 40 | G26: 12.8 | H26: 58.4 | I26: =ROUND((RC[-2]*RC[-1]),2) -> 747.52
A27: Maureen Polczynski | B27: Supervisor | C27: 2019-06-14T00:00:00.000 | D27: 2019-08-21T00:00:00.000 | E27: 176099 | F27: =RC[1]/4 -> 5.6 | G27: 22.4 | H27: 34.270000000000003 | I27: =ROUND((RC[-2]*RC[-1]),2) -> 767.65
A28: Liana Jones | B28: Supervisor | C28: 2019-06-14T00:00:00.000 | D28: 2019-08-21T00:00:00.000 | E28: 1590059525 | F28: =RC[1]/4 -> 13.2 | G28: 52.8 | H28: 67.069999999999993 | I28: =ROUND((RC[-2]*RC[-1]),2) -> 3541.3
A29: Cassie Theobald | B29: Supervisor | C29: 2019-06-14T00:00:00.000 | D29: 2019-08-21T00:00:00.000 | E29: 1590019859 | F29: =RC[1]/4 -> 0.8 | G29: 3.2 | H29: 64.88 | I29: =ROUND((RC[-2]*RC[-1]),2) -> 207.62
A30: TOTAL INSTRUCTION COST | G30: =SUM(R[-18]C:R[-1]C) -> 475.49999999999994 | I30: =(SUM(R[-18]C:R[-1]C)) -> 30759.520000000004
A32: Counseling Calculation Detail
A33: Name | B33: Role | C33: Date of Background ck | D33: Date of Technology Acceptable Use | E33: License # | F33: Hours per week | G33: Hours | H33: Hourly Rate | I33: Charge for Counseling
I34: =ROUND((RC[-2]*RC[-1]),2) -> 0
I35: =ROUND((RC[-2]*RC[-1]),2) -> 0
I36: =ROUND((RC[-2]*RC[-1]),2) -> 0
I37: =ROUND((RC[-2]*RC[-1]),2) -> 0
I38: =ROUND((RC[-2]*RC[-1]),2) -> 0
I39: =ROUND((RC[-2]*RC[-1]),2) -> 0
I40: =ROUND((RC[-2]*RC[-1]),2) -> 0
I41: =ROUND((RC[-2]*RC[-1]),2) -> 0
I42: =ROUND((RC[-2]*RC[-1]),2) -> 0
I43: =ROUND((RC[-2]*RC[-1]),2) -> 0
A44: TOTAL COUNSELING CHARGES | I44: =SUM(R[-10]C:R[-1]C) -> 0
A45: ADDITIONAL EXPLANATORY NOTES:
A46: 12/13 SC Teacher Data Day; 12/23-12/31 SC Winter Break

Sheet: Hope HS
G6: 2019-12-01T00:00:00.000
A9: School Name | B9: Hope HS | L9: Total Amount Instruction | M9: Total Amount Counseling
A10: Instruction Calculation Detail | L10: =R[18]C[-3] -> 19608.87 | M10: =R[23]C[-4] -> 0
A11: Name | B11: Role | C11: Date of Background ck | D11: Date of Technology Acceptable Use | E11: License # | F11: Hours per week | G11: Hours | H11: Hourly Rate | I11: Charge for Instruction
A12: Angela Peterson | B12: Teacher | C12: 2019-06-14T00:00:00.000 | D12: 2019-08-21T00:00:00.000 | E12: 1001311209 | F12: =RC[1]/4 -> 40 | G12: 160 | H12: 60.03 | I12: =ROUND((RC[-2]*RC[-1]),2) -> 9604.7999999999993 | L12: Maximum Hourly Rate
A13: Thomas Giesen | B13: Teacher | C13: 2019-06-14T00:00:00.000 | D13: 2019-08-21T00:00:00.000 | E13: 1601020928 | F13: =RC[1]/4 -> 37.75 | G13: 151 | H13: 62.32 | I13: =ROUND((RC[-2]*RC[-1]),2) -> 9410.32 | L13: 67.069999999999993
A18: Liana Jones | B18: Supervisor | C18: 2019-06-14T00:00:00.000 | D18: 2019-08-21T00:00:00.000 | E18: 1590059525 | F18: =RC[1]/4 -> 1.6 | G18: 6.4 | H18: 67.069999999999993 | I18: =ROUND((RC[-2]*RC[-1]),2) -> 429.25
A19: Maureen Polczynski | B19: Supervisor | C19: 2019-06-14T00:00:00.000 | D19: 2019-08-21T00:00:00.000 | E19: 176099 | F19: =RC[1]/4 -> 1.2 | G19: 4.8 | H19: 34.270000000000003 | I19: =ROUND((RC[-2]*RC[-1]),2) -> 164.5
A28: TOTAL INSTRUCTION COST | G28: =SUM(R[-16]C:R[-1]C) -> 322.2 | I28: =(SUM(R[-16]C:R[-1]C)) -> 19608.87
A30: Counseling Calculation Detail
A31: Name | B31: Role | C31: Date of Background ck | D31: Date of Technology Acceptable Use | E31: License # | F31: Hours per week | G31: Hours | H31: Hourly Rate | I31: Charge for Counseling
I32: =ROUND((RC[-2]*RC[-1]),2) -> 0
A33: TOTAL COUNSELING CHARGES | I33: =SUM(R[-1]C:R[-1]C) -> 0
A34: ADDITIONAL EXPLANATORY NOTES:
A35: 12/11 SC Students sent home early because school lost power; 12/13 SC No School; 12/18-12/20 SF Final Exams; 12/23-12/31 SC Christmas Break

Sheet: Hope Prima
H6: 2019-12-01T00:00:00.000
A9: School Name | B9: Hope Prima | L9: Total Amount Instruction | M9: Total Amount Counseling
A10: Instruction Calculation Detail | L10: =R[14]C[-3] -> 40588.35 | M10: =R[28]C[-4] -> 0
A11: Name | B11: Role | C11: Date of Background ck | D11: Date of Technology Acceptable Use | E11: License # | F11: Hours per week | G11: Hours | H11: Hourly Rate | I11: Charge for Instruction
A12: Carrie Sandberg | B12: Teacher | C12: 2019-06-14T00:00:00.000 | D12: 2019-08-21T00:00:00.000 | E12: 1015905405 | F12: =RC[1]/4 -> 40 | G12: 160 | H12: 65.180000000000007 | I12: =ROUND((RC[-2]*RC[-1]),2) -> 10428.799999999999 | L12: Maximum Hourly Rate
A13: Kimberly Mallegni | B13: Teacher | C13: 2019-06-14T00:00:00.000 | D13: 2019-08-21T00:00:00.000 | E13: 1001324415 | F13: =RC[1]/4 -> 40 | G13: 160 | H13: 63.75 | I13: =ROUND((RC[-2]*RC[-1]),2) -> 10200 | L13: 67.069999999999993
A14: April Rosengren | B14: Teacher | C14: 2019-08-15T00:00:00.000 | D14: 2019-08-21T00:00:00.000 | E14: 1590019718 | F14: =RC[1]/4 -> 40 | G14: 160 | H14: 63 | I14: =ROUND((RC[-2]*RC[-1]),2) -> 10080
A16: Suzanne Hurst | B16: Teacher | C16: 2019-06-14T00:00:00.000 | D16: 2019-08-21T00:00:00.000 | E16: 1590001127 | F16: =RC[1]/4 -> 10 | G16: 40 | H16: 26.86 | I16: =ROUND((RC[-2]*RC[-1]),2) -> 1074.4000000000001
A19: Pattie Blaszczyk | B19: Supervisor | C19: 2019-06-14T00:00:00.000 | D19: 2019-08-21T00:00:00.000 | E19: 2590003596 | F19: =RC[1]/4 -> 16 | G19: 64 | H19: 62.09 | I19: =ROUND((RC[-2]*RC[-1]),2) -> 3973.76
A20: Robin Buboltz | B20: Supervisor | C20: 2019-06-14T00:00:00.000 | D20: 2019-08-21T00:00:00.000 | E20: 1590066648 | F20: =RC[1]/4 -> 8 | G20: 32 | H20: 67.069999999999993 | I20: =ROUND((RC[-2]*RC[-1]),2) -> 2146.2399999999998
A21: Maureen Polczynski | B21: Supervisor | C21: 2019-06-14T00:00:00.000 | D21: 2019-08-21T00:00:00.000 | E21: 176099 | F21: =RC[1]/4 -> 0.8 | G21: 3.2 | H21: 34.270000000000003 | I21: =ROUND((RC[-2]*RC[-1]),2) -> 109.66
A22: Sue Biehn | B22: Supervisor | C22: 2019-06-14T00:00:00.000 | D22: 2019-08-21T00:00:00.000 | E22: 1590057967 | F22: =RC[1]/4 -> 8 | G22: 32 | H22: 67.069999999999993 | I22: =ROUND((RC[-2]*RC[-1]),2) -> 2146.2399999999998
A23: Holly Kriehn | B23: Supervisor | C23: 2019-09-23T00:00:00.000 | D23: 2019-10-17T00:00:00.000 | E23: 1001005329 | F23: 34 | G23: 6.4 | H23: 67.069999999999993 | I23: =ROUND((RC[-2]*RC[-1]),2) -> 429.25
A24: TOTAL INSTRUCTION COST | G24: =SUM(R[-12]C:R[-1]C) -> 657.6 | I24: =(SUM(R[-12]C:R[-1]C)) -> 40588.35
A26: Counseling Calculation Detail
A27: Name | B27: Role | C27: Date of Background ck | D27: Date of Technology Acceptable Use | E27: License # | F27: Hours per week | G27: Hours | H27: Hourly Rate | I27: Charge for Counseling
I28: =ROUND((RC[-2]*RC[-1]),2) -> 0
I29: =ROUND((RC[-2]*RC[-1]),2) -> 0
I30: =ROUND((RC[-2]*RC[-1]),2) -> 0
I31: =ROUND((RC[-2]*RC[-1]),2) -> 0
I32: =ROUND((RC[-2]*RC[-1]),2) -> 0
I33: =ROUND((RC[-2]*RC[-1]),2) -> 0
I34: =ROUND((RC[-2]*RC[-1]),2) -> 0
I35: =ROUND((RC[-2]*RC[-1]),2) -> 0
I36: =ROUND((RC[-2]*RC[-1]),2) -> 0
I37: =ROUND((RC[-2]*RC[-1]),2) -> 0
A38: TOTAL COUNSELING CHARGES | I38: =SUM(R[-10]C:R[-1]C) -> 0
A39: ADDITIONAL EXPLANATORY NOTES:
A40: 12/5/2019 Carrie Sandberg out--no sub available--classes cancelled, 12/5/2019 April Rosengren out--8-12 Pat Kertzman subbed, 12-4 Tom Giesen subbed, 12/13 SC Teacher Data Day; 12/23-12/31 SC Winter Break

Sheet: Hope Semper
H6: 2019-12-01T00:00:00.000
A9: School Name | B9: Hope Semper | L9: Total Amount Instruction | M9: Total Amount Counseling
A10: Instruction Calculation Detail | L10: =R[13]C[-3] -> 23335.699999999997 | M10: =R[27]C[-4] -> 0
A11: Name | B11: Role | C11: Date of Background ck | D11: Date of Technology Acceptable Use | E11: License # | F11: Hours per week | G11: Hours | H11: Hourly Rate | I11: Charge for Instruction
A12: Kaitlyn Borri | B12: Teacher | C12: 2019-06-14T00:00:00.000 | D12: 2019-08-21T00:00:00.000 | E12: 1590008214 | F12: =RC[1]/4 -> 40 | G12: 160 | H12: 63.26 | I12: =ROUND((RC[-2]*RC[-1]),2) -> 10121.6 | L12: Maximum Hourly Rate
A13: Kendra Ash | B13: Teacher | C13: 2019-06-14T00:00:00.000 | D13: 2019-08-21T00:00:00.000 | E13: 1590023640 | F13: =RC[1]/4 -> 39 | G13: 156 | H13: 64 | I13: =ROUND((RC[-2]*RC[-1]),2) -> 9984 | L13: 67.069999999999993
A17: Pattie Blaszczyk | B17: Supervisor | C17: 2019-06-14T00:00:00.000 | D17: 2019-08-21T00:00:00.000 | E17: 2590003596 | F17: =RC[1]/4 -> 4 | G17: 16 | H17: 62.09 | I17: =ROUND((RC[-2]*RC[-1]),2) -> 993.44
A18: Maureen Polczynski | B18: Supervisor | C18: 2019-06-14T00:00:00.000 | D18: 2019-08-21T00:00:00.000 | E18: 176099 | F18: =RC[1]/4 -> 2.8 | G18: 11.2 | H18: 34.270000000000003 | I18: =ROUND((RC[-2]*RC[-1]),2) -> 383.82
A19: Holly Kriehn | B19: Supervisor | C19: 2019-09-23T00:00:00.000 | D19: 2019-10-17T00:00:00.000 | E19: 1001005329 | F19: 34 | G19: 24 | H19: 67.069999999999993 | I19: =ROUND((RC[-2]*RC[-1]),2) -> 1609.68
A20: Jennifer Hockett | B20: Supervisor | C20: 2019-06-14T00:00:00.000 | D20: 2019-08-21T00:00:00.000 | E20: 1590039078 | F20: =RC[1]/4 -> 1 | G20: 4 | H20: 60.79 | I20: =ROUND((RC[-2]*RC[-1]),2) -> 243.16
A23: TOTAL INSTRUCTION COST | G23: =SUM(R[-11]C:R[-1]C) -> 371.2 | I23: =(SUM(R[-11]C:R[-1]C)) -> 23335.699999999997
A25: Counseling Calculation Detail
A26: Name | B26: Role | C26: Date of Background ck | D26: Date of Technology Acceptable Use | E26: License # | F26: Hours per week | G26: Hours | H26: Hourly Rate | I26: Charge for Counseling
I27: =ROUND((RC[-2]*RC[-1]),2) -> 0
I28: =ROUND((RC[-2]*RC[-1]),2) -> 0
I29: =ROUND((RC[-2]*RC[-1]),2) -> 0
I30: =ROUND((RC[-2]*RC[-1]),2) -> 0
I31: =ROUND((RC[-2]*RC[-1]),2) -> 0
I32: =ROUND((RC[-2]*RC[-1]),2) -> 0
I33: =ROUND((RC[-2]*RC[-1]),2) -> 0
I34: =ROUND((RC[-2]*RC[-1]),2) -> 0
I35: =ROUND((RC[-2]*RC[-1]),2) -> 0
I36: =ROUND((RC[-2]*RC[-1]),2) -> 0
A37: TOTAL COUNSELING CHARGES | I37: =SUM(R[-10]C:R[-1]C) -> 0
A38: ADDITIONAL EXPLANATORY NOTES:
A39: 12/13 SC Teacher Data Day; 12/20/19-Kaitlin Borri out--Rachel Geislinger subbed; 12/23-12/31 SC Winter Break

Sheet: Kingdom Prep HS
H6: 2019-12-01T00:00:00.000
A9: School Name | B9: Kingdom Prep | L9: Total Amount Instruction | M9: Total Amount Counseling
A10: Instruction Calculation Detail | L10: =R[12]C[-3] -> 4939.420000000001 | M10: =R[26]C[-4] -> 0
A11: Name | B11: Role | C11: Date of Background ck | D11: Date of Technology Acceptable Use | E11: License # | F11: Hours per week | G11: Hours | H11: Hourly Rate | I11: Charge for Instruction
A12: Kulbir Sra | B12: Teacher | C12: 2019-06-14T00:00:00.000 | D12: 2019-08-21T00:00:00.000 | E12: 1001307890 | F12: =RC[1]/4 -> 20 | G12: 80 | H12: 59.06 | I12: =ROUND((RC[-2]*RC[-1]),2) -> 4724.8 | L12: Maximum Hourly Rate
L13: 67.069999999999993
A20: Maureen Mueller | B20: Supervisor | C20: 2019-06-14T00:00:00.000 | D20: 2019-08-21T00:00:00.000 | E20: 1590015250 | F20: =RC[1]/4 -> 0.4 | G20: 1.6 | H20: 67.069999999999993 | I20: =ROUND((RC[-2]*RC[-1]),2) -> 107.31
A21: Liana Jones | B21: Supervisor | C21: 2019-06-14T00:00:00.000 | D21: 2019-08-21T00:00:00.000 | E21: 1590059525 | F21: =RC[1]/4 -> 0.4 | G21: 1.6 | H21: 67.069999999999993 | I21: =ROUND((RC[-2]*RC[-1]),2) -> 107.31
A22: TOTAL INSTRUCTION COST | G22: =SUM(R[-10]C:R[-1]C) -> 83.199999999999989 | I22: =(SUM(R[-10]C:R[-1]C)) -> 4939.420000000001
A24: Counseling Calculation Detail
A25: Name | B25: Role | C25: Date of Background ck | D25: Date of Technology Acceptable Use | E25: License # | F25: Hours per week | G25: Hours | H25: Hourly Rate | I25: Charge for Counseling
I26: =ROUND((RC[-2]*RC[-1]),2) -> 0
I27: =ROUND((RC[-2]*RC[-1]),2) -> 0
I28: =ROUND((RC[-2]*RC[-1]),2) -> 0
I29: =ROUND((RC[-2]*RC[-1]),2) -> 0
I30: =ROUND((RC[-2]*RC[-1]),2) -> 0
I31: =ROUND((RC[-2]*RC[-1]),2) -> 0
I32: =ROUND((RC[-2]*RC[-1]),2) -> 0
I33: =ROUND((RC[-2]*RC[-1]),2) -> 0
I34: =ROUND((RC[-2]*RC[-1]),2) -> 0
I35: =ROUND((RC[-2]*RC[-1]),2) -> 0
A36: TOTAL COUNSELING CHARGES | I36: =SUM(R[-10]C:R[-1]C) -> 0
A37: ADDITIONAL EXPLANATORY NOTES:
A38: 12/23-12/31 SC Christmas Break

Sheet: Messmer
G6: 2019-12-01T00:00:00.000
A9: School Name | B9: Messmer | L9: Total Amount Instruction | M9: Total Amount Counseling
A10: Instruction Calculation Detail | L10: =R[30]C[-3] -> 117622.55 | M10: =R[35]C[-4] -> 0
A11: Name | B11: Role | C11: Date of Background ck | D11: Date of Technology Acceptable Use | E11: License # | F11: Hours per week | G11: Hours | H11: Hourly Rate | I11: Charge for Instruction
A12: Debra Bartman HS | B12: Teacher | C12: 2019-06-14T00:00:00.000 | D12: 2019-08-21T00:00:00.000 | E12: 1015914329 | F12: =RC[1]/4 -> 39 | G12: 156 | H12: 64.36 | I12: =ROUND((RC[-2]*RC[-1]),2) -> 10040.16 | L12: Maximum Hourly Rate
A13: Lori Rorabek HS | B13: Teacher | C13: 2019-06-14T00:00:00.000 | D13: 2019-08-21T00:00:00.000 | E13: 1590019988 | F13: =RC[1]/4 -> 39 | G13: 156 | H13: 67.069999999999993 | I13: =ROUND((RC[-2]*RC[-1]),2) -> 10462.92
A14: Pattie Lopez HS | B14: Teacher | C14: 2019-06-14T00:00:00.000 | D14: 2019-08-21T00:00:00.000 | E14: 1590002992 | F14: =RC[1]/4 -> 39 | G14: 156 | H14: 67.069999999999993 | I14: =ROUND((RC[-2]*RC[-1]),2) -> 10462.92
A15: Jamie Rhode HS | B15: Teacher | C15: 2019-06-14T00:00:00.000 | D15: 2019-08-21T00:00:00.000 | E15: 1590048251 | F15: =RC[1]/4 -> 38.25 | G15: 153 | H15: 65.319999999999993 | I15: =ROUND((RC[-2]*RC[-1]),2) -> 9993.9599999999991
A16: Donald Chevako SM | B16: Teacher | C16: 2019-06-14T00:00:00.000 | D16: 2019-08-21T00:00:00.000 | E16: 1590060221 | F16: =RC[1]/4 -> 40 | G16: 160 | H16: 62.36 | I16: =ROUND((RC[-2]*RC[-1]),2) -> 9977.6
A17: Lynn Hutchinson SM | B17: Teacher | C17: 2019-06-14T00:00:00.000 | D17: 2019-08-21T00:00:00.000 | E17: 1590029940 | F17: =RC[1]/4 -> 40 | G17: 160 | H17: 62.01 | I17: =ROUND((RC[-2]*RC[-1]),2) -> 9921.6
A18: Megan Sawinski SM | B18: Teacher | C18: 2019-06-14T00:00:00.000 | D18: 2019-08-21T00:00:00.000 | E18: 1015917179 | F18: =RC[1]/4 -> 40 | G18: 160 | H18: 65 | I18: =ROUND((RC[-2]*RC[-1]),2) -> 10400
A19: Sara Bailey SR | B19: Teacher | C19: 2019-06-19T00:00:00.000 | D19: 2019-08-21T00:00:00.000 | E19: 1590028820 | F19: =RC[1]/4 -> 39 | G19: 156 | H19: 66 | I19: =ROUND((RC[-2]*RC[-1]),2) -> 10296
A20: Amy Stillson sr | B20: Teacher | C20: 2019-06-14T00:00:00.000 | D20: 2019-08-21T00:00:00.000 | E20: 1590059710 | F20: =RC[1]/4 -> 39 | G20: 156 | H20: 63.03 | I20: =ROUND((RC[-2]*RC[-1]),2) -> 9832.68
A21: Paige Hase SR | B21: Teacher | C21: 2019-06-14T00:00:00.000 | D21: 2019-08-21T00:00:00.000 | E21: 100134449 | F21: =RC[1]/4 -> 39 | G21: 156 | H21: 65 | I21: =ROUND((RC[-2]*RC[-1]),2) -> 10140
A23: Thomas Giesen | B23: Teacher | C23: 2019-06-14T00:00:00.000 | D23: 2019-08-21T00:00:00.000 | E23: 1601020928 | F23: =RC[1]/4 -> 0.75 | G23: 3 | H23: 62.32 | I23: =ROUND((RC[-2]*RC[-1]),2) -> 186.96
A25: Heidi Egner | B25: Supervisor | C25: 2019-06-14T00:00:00.000 | D25: 2019-08-21T00:00:00.000 | E25: 1590039829 | F25: =RC[1]/4 -> 4 | G25: 16 | H25: 64.819999999999993 | I25: =ROUND((RC[-2]*RC[-1]),2) -> 1037.1199999999999
A26: Maureen Mueller | B26: Supervisor | C26: 2019-06-14T00:00:00.000 | D26: 2019-08-21T00:00:00.000 | E26: 1590015250 | F26: =RC[1]/4 -> 34 | G26: 136 | H26: 67.069999999999993 | I26: =ROUND((RC[-2]*RC[-1]),2) -> 9121.52
A27: Maureen Polczynski | B27: Supervisor | C27: 2019-06-14T00:00:00.000 | D27: 2019-08-21T00:00:00.000 | E27: 176099 | F27: =RC[1]/4 -> 1.4 | G27: 5.6 | H27: 34.270000000000003 | I27: =ROUND((RC[-2]*RC[-1]),2) -> 191.91
A28: Liana Jones | B28: Supervisor | C28: 2019-06-14T00:00:00.000 | D28: 2019-08-21T00:00:00.000 | E28: 1590059525 | F28: =RC[1]/4 -> 3 | G28: 12 | H28: 67.069999999999993 | I28: =ROUND((RC[-2]*RC[-1]),2) -> 804.84
A29: Joelle Amberg | B29: Supervisor | C29: 2019-06-14T00:00:00.000 | D29: 2019-08-21T00:00:00.000 | E29: 1590047303 | F29: =RC[1]/4 -> 5.2 | G29: 20.8 | H29: 67.069999999999993 | I29: =ROUND((RC[-2]*RC[-1]),2) -> 1395.06
A30: Jane Haessly | B30: Supervisor | C30: 2019-06-14T00:00:00.000 | D30: 2019-08-21T00:00:00.000 | E30: 1590004207 | F30: 40 | G30: 33.6 | H30: 58.4 | I30: =ROUND((RC[-2]*RC[-1]),2) -> 1962.24
A31: Ellen Sternig | B31: Supervisor | C31: 2019-06-14T00:00:00.000 | D31: 2019-08-21T00:00:00.000 | E31: 2800004552 | F31: =RC[1]/4 -> 5.2 | G31: 20.8 | H31: 67.069999999999993 | I31: =ROUND((RC[-2]*RC[-1]),2) -> 1395.06
A40: TOTAL INSTRUCTION COST | G40: =SUM(R[-28]C:R[-1]C) -> 1816.7999999999997 | I40: =(SUM(R[-28]C:R[-1]C)) -> 117622.55
A42: Counseling Calculation Detail
A43: Name | B43: Role | C43: Date of Background ck | D43: Date of Technology Acceptable Use | E43: License # | F43: Hours per week | G43: Hours | H43: Hourly Rate | I43: Charge for Counseling
I44: =ROUND((RC[-2]*RC[-1]),2) -> 0
A45: TOTAL COUNSELING CHARGES | I45: =SUM(R[-1]C:R[-1]C) -> 0
A46: ADDITIONAL EXPLANATORY NOTES:
A47: MHS - 12/18-12/20 SF Final Exams; 12/23-12/31 SC Christmas Break
A48: MSM - 12/23-12/31 SC Winter Break
A49: MSR - 12/4 - P. Hase out 1/2 day P. Kertzman subbing 12/12 - P. Hase out 1/2 day T. Giesen subbing 12/23-12/31 SC Winter Break

Sheet: Nativity Jesuit
H6: 2019-12-01T00:00:00.000
A9: School Name | B9: Nativity Jesuit | L9: Total Amount Instruction | M9: Total Amount Counseling
A10: Instruction Calculation Detail | L10: =R[14]C[-3] -> 12451.46 | M10: =R[28]C[-4] -> 0
A11: Name | B11: Role | C11: Date of Background ck | D11: Date of Technology Acceptable Use | E11: License # | F11: Hours per week | G11: Hours | H11: Hourly Rate | I11: Charge for Instruction
A12: Heather Peters | B12: Teacher | C12: 2019-10-10T00:00:00.000 | D12: 2019-10-10T00:00:00.000 | E12: 1590075263 | F12: =RC[1]/4 -> 40 | G12: 160 | H12: 64.900000000000006 | I12: =ROUND((RC[-2]*RC[-1]),2) -> 10384 | L12: Maximum Hourly Rate
L13: 67.069999999999993
A20: Sue Biehn | B20: Supervisor | C20: 2019-06-14T00:00:00.000 | D20: 2019-08-21T00:00:00.000 | E20: 1590057967 | F20: =RC[1]/4 -> 2.8 | G20: 11.2 | H20: 67.069999999999993 | I20: =ROUND((RC[-2]*RC[-1]),2) -> 751.18
A21: Holly Kriehn | B21: Supervisor | C21: 2019-09-23T00:00:00.000 | D21: 2019-10-17T00:00:00.000 | E21: 1001005329 | F21: 34 | G21: 8 | H21: 67.069999999999993 | I21: =ROUND((RC[-2]*RC[-1]),2) -> 536.55999999999995
A22: Robin Buboltz | B22: Supervisor | C22: 2019-06-14T00:00:00.000 | D22: 2019-08-21T00:00:00.000 | E22: 1590066648 | F22: =RC[1]/4 -> 2 | G22: 8 | H22: 67.069999999999993 | I22: =ROUND((RC[-2]*RC[-1]),2) -> 536.55999999999995
A23: Jennifer Hockett | B23: Supervisor | C23: 2019-06-14T00:00:00.000 | D23: 2019-08-21T00:00:00.000 | E23: 1590039078 | F23: =RC[1]/4 -> 1 | G23: 4 | H23: 60.79 | I23: =ROUND((RC[-2]*RC[-1]),2) -> 243.16
A24: TOTAL INSTRUCTION COST | G24: =SUM(R[-12]C:R[-1]C) -> 191.2 | I24: =(SUM(R[-12]C:R[-1]C)) -> 12451.46
A26: Counseling Calculation Detail
A27: Name | B27: Role | C27: Date of Background ck | D27: Date of Technology Acceptable Use | E27: License # | F27: Hours per week | G27: Hours | H27: Hourly Rate | I27: Charge for Counseling
I28: =ROUND((RC[-2]*RC[-1]),2) -> 0
I29: =ROUND((RC[-2]*RC[-1]),2) -> 0
I30: =ROUND((RC[-2]*RC[-1]),2) -> 0
I31: =ROUND((RC[-2]*RC[-1]),2) -> 0
I32: =ROUND((RC[-2]*RC[-1]),2) -> 0
I33: =ROUND((RC[-2]*RC[-1]),2) -> 0
I34: =ROUND((RC[-2]*RC[-1]),2) -> 0
I35: =ROUND((RC[-2]*RC[-1]),2) -> 0
I36: =ROUND((RC[-2]*RC[-1]),2) -> 0
I37: =ROUND((RC[-2]*RC[-1]),2) -> 0
A38: TOTAL COUNSELING CHARGES | I38: =SUM(R[-10]C:R[-1]C) -> 0
A39: ADDITIONAL EXPLANATORY NOTES:
A40: 12/23-12/31 SC Winter Break

Sheet: Notre Dame
H6: 2019-12-01T00:00:00.000
A9: School Name | B9: Notre Dame | L9: Total Amount Instruction | M9: Total Amount Counseling
A10: Instruction Calculation Detail | L10: =R[13]C[-3] -> 31341.58 | M10: =R[27]C[-4] -> 0
A11: Name | B11: Role | C11: Date of Background ck | D11: Date of Technology Acceptable Use | E11: License # | F11: Hours per week | G11: Hours | H11: Hourly Rate | I11: Charge for Instruction
A12: Nancy Pernovic | B12: Teacher | C12: 2019-06-14T00:00:00.000 | D12: 2019-08-21T00:00:00.000 | E12: 2590002941 | F12: =RC[1]/4 -> 34 | G12: 136 | H12: 67.069999999999993 | I12: =ROUND((RC[-2]*RC[-1]),2) -> 9121.52 | L12: Maximum Hourly Rate
A13: Teri Norton | B13: Teacher | C13: 2019-06-14T00:00:00.000 | D13: 2019-08-21T00:00:00.000 | E13: 1590032770 | F13: =RC[1]/4 -> 40 | G13: 160 | H13: 67.069999999999993 | I13: =ROUND((RC[-2]*RC[-1]),2) -> 10731.2 | L13: 67.069999999999993
A14: Karen Crane | B14: Teacher | C14: 2019-06-14T00:00:00.000 | D14: 2019-08-21T00:00:00.000 | E14: 1015911349 | F14: =RC[1]/4 -> 31.25 | G14: 125 | H14: 67.069999999999993 | I14: =ROUND((RC[-2]*RC[-1]),2) -> 8383.75
A18: Heidi Egner | B18: Supervisor | C18: 2019-06-14T00:00:00.000 | D18: 2019-08-21T00:00:00.000 | E18: 1590039829 | F18: =RC[1]/4 -> 2.4 | G18: 9.6 | H18: 64.819999999999993 | I18: =ROUND((RC[-2]*RC[-1]),2) -> 622.27
A19: Jennifer Hockett | B19: Supervisor | C19: 2019-06-14T00:00:00.000 | D19: 2019-08-21T00:00:00.000 | E19: 1590039078 | F19: =RC[1]/4 -> 1 | G19: 4 | H19: 60.79 | I19: =ROUND((RC[-2]*RC[-1]),2) -> 243.16
A20: Jane Haessly | B20: Supervisor | C20: 2019-06-14T00:00:00.000 | D20: 2019-08-21T00:00:00.000 | E20: 1590004207 | F20: 40 | G20: 1.6 | H20: 58.4 | I20: =ROUND((RC[-2]*RC[-1]),2) -> 93.44
A21: Joelle Amberg | B21: Supervisor | C21: 2019-06-14T00:00:00.000 | D21: 2019-08-21T00:00:00.000 | E21: 1590047303 | F21: =RC[1]/4 -> 8 | G21: 32 | H21: 67.069999999999993 | I21: =ROUND((RC[-2]*RC[-1]),2) -> 2146.2399999999998
A23: TOTAL INSTRUCTION COST | G23: =SUM(R[-11]C:R[-1]C) -> 468.20000000000005 | I23: =(SUM(R[-11]C:R[-1]C)) -> 31341.58
A25: Counseling Calculation Detail
A26: Name | B26: Role | C26: Date of Background ck | D26: Date of Technology Acceptable Use | E26: License # | F26: Hours per week | G26: Hours | H26: Hourly Rate | I26: Charge for Counseling
I27: =ROUND((RC[-2]*RC[-1]),2) -> 0
I28: =ROUND((RC[-2]*RC[-1]),2) -> 0
I29: =ROUND((RC[-2]*RC[-1]),2) -> 0
I30: =ROUND((RC[-2]*RC[-1]),2) -> 0
I31: =ROUND((RC[-2]*RC[-1]),2) -> 0
I32: =ROUND((RC[-2]*RC[-1]),2) -> 0
I33: =ROUND((RC[-2]*RC[-1]),2) -> 0
I34: =ROUND((RC[-2]*RC[-1]),2) -> 0
I35: =ROUND((RC[-2]*RC[-1]),2) -> 0
I36: =ROUND((RC[-2]*RC[-1]),2) -> 0
A37: TOTAL COUNSELING CHARGES | I37: =SUM(R[-10]C:R[-1]C) -> 0
A38: ADDITIONAL EXPLANATORY NOTES:
A39: 12/20-12/31 - SC: Winter Break

Sheet: Risen Savior
H6: 2019-12-01T00:00:00.000
A9: School Name | B9: Risen Savior | L9: Total Amount Instruction | M9: Total Amount Counseling
A10: Instruction Calculation Detail | L10: =R[30]C[-3] -> 14119.769999999999 | M10: =R[36]C[-4] -> 0
A11: Name | B11: Role | C11: Date of Background ck | D11: Date of Technology Acceptable Use | E11: License # | F11: Hours per week | G11: Hours | H11: Hourly Rate | I11: Charge for Instruction
A12: Tracy Bamberger | B12: Teacher | C12: 2019-06-14T00:00:00.000 | D12: 2019-08-21T00:00:00.000 | E12: 1590060719 | F12: =RC[1]/4 -> 25.2 | G12: 100.8 | H12: 36.979999999999997 | I12: =ROUND((RC[-2]*RC[-1]),2) -> 3727.58 | L12: Maximum Hourly Rate
A13: Ann Krueger | B13: Teacher | C13: 2019-06-14T00:00:00.000 | D13: 2019-08-21T00:00:00.000 | E13: 1800032839 | F13: =RC[1]/4 -> 26 | G13: 104 | H13: 42.74 | I13: =ROUND((RC[-2]*RC[-1]),2) -> 4444.96
A14: Jim Botting | B14: Teacher | C14: 2019-07-03T00:00:00.000 | D14: 2019-08-21T00:00:00.000 | E14: 2590004757 | F14: =RC[1]/4 -> 16 | G14: 64 | H14: 30.72 | I14: =ROUND((RC[-2]*RC[-1]),2) -> 1966.08
A17: Holly Kriehn | B17: Supervisor | C17: 2019-09-23T00:00:00.000 | D17: 2019-10-17T00:00:00.000 | E17: 1001005329 | F17: 34 | G17: 1.6 | H17: 67.069999999999993 | I17: =ROUND((RC[-2]*RC[-1]),2) -> 107.31
A18: Robin Buboltz | B18: Supervisor | C18: 2019-06-14T00:00:00.000 | D18: 2019-08-21T00:00:00.000 | E18: 1590066648 | F18: =RC[1]/4 -> 10 | G18: 40 | H18: 67.069999999999993 | I18: =ROUND((RC[-2]*RC[-1]),2) -> 2682.8
A19: Maureen Polczynski | B19: Supervisor | C19: 2019-06-14T00:00:00.000 | D19: 2019-08-21T00:00:00.000 | E19: 176099 | F19: 6 | G19: 19.2 | H19: 34.270000000000003 | I19: =ROUND((RC[-2]*RC[-1]),2) -> 657.98
A20: Cassie Theobald | B20: Supervisor | C20: 2019-06-14T00:00:00.000 | D20: 2019-08-21T00:00:00.000 | E20: 1590019859 | F20: =RC[1]/4 -> 0.4 | G20: 1.6 | H20: 64.88 | I20: =ROUND((RC[-2]*RC[-1]),2) -> 103.81
A21: Ellen Sternig | B21: Supervisor | C21: 2019-06-14T00:00:00.000 | D21: 2019-08-21T00:00:00.000 | E21: 2800004552 | F21: =RC[1]/4 -> 1.6 | G21: 6.4 | H21: 67.069999999999993 | I21: =ROUND((RC[-2]*RC[-1]),2) -> 429.25
I22: =ROUND((RC[-2]*RC[-1]),2) -> 0
I23: =ROUND((RC[-2]*RC[-1]),2) -> 0
I24: =ROUND((RC[-2]*RC[-1]),2) -> 0
I25: =ROUND((RC[-2]*RC[-1]),2) -> 0
I26: =ROUND((RC[-2]*RC[-1]),2) -> 0
I27: =ROUND((RC[-2]*RC[-1]),2) -> 0
I28: =ROUND((RC[-2]*RC[-1]),2) -> 0
I29: =ROUND((RC[-2]*RC[-1]),2) -> 0
I30: =ROUND((RC[-2]*RC[-1]),2) -> 0
I31: =ROUND((RC[-2]*RC[-1]),2) -> 0
I32: =ROUND((RC[-2]*RC[-1]),2) -> 0
I33: =ROUND((RC[-2]*RC[-1]),2) -> 0
I34: =ROUND((RC[-2]*RC[-1]),2) -> 0
I35: =ROUND((RC[-2]*RC[-1]),2) -> 0
I36: =ROUND((RC[-2]*RC[-1]),2) -> 0
I37: =ROUND((RC[-2]*RC[-1]),2) -> 0
I38: =ROUND((RC[-2]*RC[-1]),2) -> 0
I39: =ROUND((RC[-2]*RC[-1]),2) -> 0
A40: TOTAL INSTRUCTION COST | G40: =SUM(R[-28]C:R[-1]C) -> 337.6 | I40: =(SUM(R[-28]C:R[-1]C)) -> 14119.769999999999
A42: Counseling Calculation Detail
A43: Name | B43: Role | C43: Date of Background ck | D43: Date of Technology Acceptable Use | E43: License # | F43: Hours per week | G43: Hours | H43: Hourly Rate | I43: Charge for Counseling
I44: =ROUND((RC[-2]*RC[-1]),2) -> 0
I45: =ROUND((RC[-2]*RC[-1]),2) -> 0
A46: TOTAL COUNSELING CHARGES | I46: =SUM(R[-2]C:R[-1]C) -> 0
A47: ADDITIONAL EXPLANATORY NOTES:
A48: 12/2 No School, TA: H. Egner Sub, 12/23-12/31 - SC: Winter Break

Sheet: St. Anthony
G6: 2019-12-01T00:00:00.000
A9: School Name | B9: St. Anthony | L9: Total Amount Instruction | M9: Total Amount Counseling
A10: Instruction Calculation Detail | L10: =R[28]C[-3] -> 105638.85 | M10: =R[35]C[-4] -> 0
A11: Name | B11: Role | C11: Date of Background ck | D11: Date of Technology Acceptable Use | E11: License # | F11: Hours per week | G11: Hours | H11: Hourly Rate | I11: Charge for Instruction
A12: Erica Bale | B12: 5th St teacher | C12: 2019-06-14T00:00:00.000 | D12: 2019-08-21T00:00:00.000 | E12: 1590021572 | F12: =RC[1]/4 -> 40 | G12: 160 | H12: 67.069999999999993 | I12: =ROUND((RC[-2]*RC[-1]),2) -> 10731.2 | L12: Maximum Hourly Rate
A13: Liz Braun | B13: 5th St teacher | C13: 2019-06-14T00:00:00.000 | D13: 2019-08-21T00:00:00.000 | E13: 2590002418 | F13: =RC[1]/4 -> 27.25 | G13: 109 | H13: 65.22 | I13: =ROUND((RC[-2]*RC[-1]),2) -> 7108.98 | L13: 67.069999999999993
A14: Deb Doherty | B14: 5th St teacher | C14: 2019-06-14T00:00:00.000 | D14: 2019-08-21T00:00:00.000 | E14: 1590067733 | F14: =RC[1]/4 -> 23.5 | G14: 94 | H14: 64.02 | I14: =ROUND((RC[-2]*RC[-1]),2) -> 6017.88
A16: Barbara Chipman | B16: 9th St teacher | C16: 2019-06-14T00:00:00.000 | D16: 2019-08-21T00:00:00.000 | E16: 1590017099 | F16: =RC[1]/4 -> 31 | G16: 124 | H16: 64.959999999999994 | I16: =ROUND((RC[-2]*RC[-1]),2) -> 8055.04
A17: Peggy Thurner | B17: 9th St teacher | C17: 2019-06-14T00:00:00.000 | D17: 2019-08-21T00:00:00.000 | E17: 1590039521 | F17: =RC[1]/4 -> 31 | G17: 124 | H17: 66.03 | I17: =ROUND((RC[-2]*RC[-1]),2) -> 8187.72
A18: Sandra Preiss | B18: 9th St teacher | C18: 2019-06-14T00:00:00.000 | D18: 2019-08-21T00:00:00.000 | E18: 1590064877 | F18: =RC[1]/4 -> 31 | G18: 124 | H18: 65 | I18: =ROUND((RC[-2]*RC[-1]),2) -> 8060
A19: Cathy Dalton | B19: 9th St teacher | C19: 2019-06-14T00:00:00.000 | D19: 2019-08-21T00:00:00.000 | E19: 2590002807 | F19: =RC[1]/4 -> 31 | G19: 124 | H19: 66.3 | I19: =ROUND((RC[-2]*RC[-1]),2) -> 8221.2000000000007
A20: Kallie Davy | B20: MS Teacher | C20: 2019-06-14T00:00:00.000 | D20: 2019-08-21T00:00:00.000 | E20: 1015921918 | F20: =RC[1]/4 -> 40 | G20: 160 | H20: 65.150000000000006 | I20: =ROUND((RC[-2]*RC[-1]),2) -> 10424
A21: Tim Miller | B21: MS Teacher | C21: 2019-06-14T00:00:00.000 | D21: 2019-08-21T00:00:00.000 | E21: 2590002349 | F21: =RC[1]/4 -> 16.399999999999999 | G21: 65.599999999999994 | H21: 64.2 | I21: =ROUND((RC[-2]*RC[-1]),2) -> 4211.5200000000004
A24: Cassie Theobald | B24: Supervisor | C24: 2019-06-14T00:00:00.000 | D24: 2019-08-21T00:00:00.000 | E24: 1590019859 | F24: =RC[1]/4 -> 36 | G24: 144 | H24: 64.88 | I24: =ROUND((RC[-2]*RC[-1]),2) -> 9342.7199999999993
A26: Holly Kriehn | B26: Supervisor | C26: 2019-09-23T00:00:00.000 | D26: 2019-10-17T00:00:00.000 | E26: 1001005329 | F26: 34 | G26: 32 | H26: 67.069999999999993 | I26: =ROUND((RC[-2]*RC[-1]),2) -> 2146.2399999999998
A27: Jennifer Hockett | B27: Supervisor | C27: 2019-06-14T00:00:00.000 | D27: 2019-08-21T00:00:00.000 | E27: 1590039078 | F27: =RC[1]/4 -> 30 | G27: 120 | H27: 60.79 | I27: =ROUND((RC[-2]*RC[-1]),2) -> 7294.8
A28: Robin Buboltz | B28: Supervisor | C28: 2019-06-14T00:00:00.000 | D28: 2019-08-21T00:00:00.000 | E28: 1590066648 | F28: =RC[1]/4 -> 4 | G28: 16 | H28: 67.069999999999993 | I28: =ROUND((RC[-2]*RC[-1]),2) -> 1073.1199999999999
A29: Jane Haessly | B29: Supervisor | C29: 2019-06-14T00:00:00.000 | D29: 2019-08-21T00:00:00.000 | E29: 1590004207 | F29: =RC[1]/4 -> 6.8 | G29: 27.2 | H29: 58.4 | I29: =ROUND((RC[-2]*RC[-1]),2) -> 1588.48
A30: Joelle Amberg | B30: Supervisor | C30: 2019-06-14T00:00:00.000 | D30: 2019-08-21T00:00:00.000 | E30: 1590047303 | F30: =RC[1]/4 -> 13.2 | G30: 52.8 | H30: 67.069999999999993 | I30: =ROUND((RC[-2]*RC[-1]),2) -> 3541.3
A31: Liana Jones | B31: Supervisor | C31: 2019-06-14T00:00:00.000 | D31: 2019-08-21T00:00:00.000 | E31: 1590059525 | F31: =RC[1]/4 -> 10.4 | G31: 41.6 | H31: 67.069999999999993 | I31: =ROUND((RC[-2]*RC[-1]),2) -> 2790.11
A32: Sue Biehn | B32: Supervisor | C32: 2019-06-14T00:00:00.000 | D32: 2019-08-21T00:00:00.000 | E32: 1590057967 | F32: =RC[1]/4 -> 4 | G32: 16 | H32: 67.069999999999993 | I32: =ROUND((RC[-2]*RC[-1]),2) -> 1073.1199999999999
A33: Ellen Sternig | B33: Supervisor | C33: 2019-06-14T00:00:00.000 | D33: 2019-08-21T00:00:00.000 | E33: 2800004552 | F33: =RC[1]/4 -> 7.8 | G33: 31.2 | H33: 67.069999999999993 | I33: =ROUND((RC[-2]*RC[-1]),2) -> 2092.58
A34: Maureen Polczynski | B34: Supervisor | C34: 2019-06-14T00:00:00.000 | D34: 2019-08-21T00:00:00.000 | E34: 176099 | F34: =RC[1]/4 -> 10.4 | G34: 41.6 | H34: 34.270000000000003 | I34: =ROUND((RC[-2]*RC[-1]),2) -> 1425.63
A35: Maureen Mueller | B35: Supervisor | C35: 2019-06-14T00:00:00.000 | D35: 2019-08-21T00:00:00.000 | E35: 1590015250 | F35: =RC[1]/4 -> 2.6 | G35: 10.4 | H35: 67.069999999999993 | I35: =ROUND((RC[-2]*RC[-1]),2) -> 697.53
A36: Heidi Egner | B36: Supervisor | C36: 2019-06-14T00:00:00.000 | D36: 2019-08-21T00:00:00.000 | E36: 1590039829 | F36: =RC[1]/4 -> 6 | G36: 24 | H36: 64.819999999999993 | I36: =ROUND((RC[-2]*RC[-1]),2) -> 1555.68
A38: TOTAL INSTRUCTION COST | G38: =SUM(R[-26]C:R[-1]C) -> 1641.3999999999999 | I38: =(SUM(R[-26]C:R[-1]C)) -> 105638.85
A40: Counseling Calculation Detail
A41: Name | B41: Role | C41: Date of Background ck | D41: Date of Technology Acceptable Use | E41: License # | F41: Hours per week | G41: Hours | H41: Hourly Rate | I41: Charge for Counseling
I42: =ROUND((RC[-2]*RC[-1]),2) -> 0
I43: =ROUND((RC[-2]*RC[-1]),2) -> 0
I44: =ROUND((RC[-2]*RC[-1]),2) -> 0
A45: TOTAL COUNSELING CHARGES | I45: =SUM(R[-3]C:R[-1]C) -> 0
A46: ADDITIONAL EXPLANATORY NOTES:
A47: 12/3 TA at SAS 9th St (Barb Chipman was out and there was not a sub available for her students); 12/20 - 12/31 SC: Winter Break

Sheet: St. Gregory
H6: 2019-12-01T00:00:00.000
A9: School Name | B9: St. Gregory | L9: Total Amount Instruction | M9: Total Amount Counseling
A10: Instruction Calculation Detail | L10: =R[32]C[-3] -> 10663.21 | M10: =R[46]C[-4] -> 0
A11: Name | B11: Role | C11: Date of Background ck | D11: Date of Technology Acceptable Use | E11: License # | F11: Hours per week | G11: Hours | H11: Hourly Rate | I11: Charge for Instruction
A12: Donna Ragalie | B12: teacher | C12: 2019-06-14T00:00:00.000 | E12: 1015921430 | F12: =RC[1]/4 -> 38.25 | G12: 153 | H12: 67.069999999999993 | I12: =ROUND((RC[-2]*RC[-1]),2) -> 10261.709999999999 | L12: Maximum Hourly Rate
L13: 67.069999999999993
A26: Jane Haessly | B26: Supervisor | C26: 2019-06-14T00:00:00.000 | D26: 2019-08-21T00:00:00.000 | E26: 1590004207 | F26: =RC[1]/4 -> 0.8 | G26: 3.2 | H26: 58.4 | I26: =ROUND((RC[-2]*RC[-1]),2) -> 186.88
A27: Maureen Mueller | B27: Supervisor | C27: 2019-06-14T00:00:00.000 | D27: 2019-08-21T00:00:00.000 | E27: 1590015250 | F27: =RC[1]/4 -> 0.8 | G27: 3.2 | H27: 67.069999999999993 | I27: =ROUND((RC[-2]*RC[-1]),2) -> 214.62
A42: TOTAL INSTRUCTION COST | G42: =SUM(R[-30]C:R[-1]C) -> 159.39999999999998 | I42: =(SUM(R[-30]C:R[-1]C)) -> 10663.21
A44: Counseling Calculation Detail
A45: Name | B45: Role | C45: Date of Background ck | D45: Date of Technology Acceptable Use | E45: License # | F45: Hours per week | G45: Hours | H45: Hourly Rate | I45: Charge for Counseling
I46: =ROUND((RC[-2]*RC[-1]),2) -> 0
I47: =ROUND((RC[-2]*RC[-1]),2) -> 0
I48: =ROUND((RC[-2]*RC[-1]),2) -> 0
I49: =ROUND((RC[-2]*RC[-1]),2) -> 0
I50: =ROUND((RC[-2]*RC[-1]),2) -> 0
I51: =ROUND((RC[-2]*RC[-1]),2) -> 0
I52: =ROUND((RC[-2]*RC[-1]),2) -> 0
I53: =ROUND((RC[-2]*RC[-1]),2) -> 0
I54: =ROUND((RC[-2]*RC[-1]),2) -> 0
I55: =ROUND((RC[-2]*RC[-1]),2) -> 0
A56: TOTAL COUNSELING CHARGES | I56: =SUM(R[-10]C:R[-1]C) -> 0
A57: ADDITIONAL EXPLANATORY NOTES:
A58: 12/23-12/31 SC Winter Break

Sheet: St. Joan Antida
H6: 2019-12-01T00:00:00.000
A9: School Name | B9: St. Joan Antida | L9: Total Amount Instruction | M9: Total Amount Counseling
A10: Instruction Calculation Detail | L10: =R[10]C[-3] -> 7165.95 | M10: =R[24]C[-4] -> 0
A11: Name | B11: Role | C11: Date of Background ck | D11: Date of Technology Acceptable Use | E11: License # | F11: Hours per week | G11: Hours | H11: Hourly Rate | I11: Charge for Instruction
A12: Pat Wickert | B12: Teacher | C12: 2019-06-14T00:00:00.000 | D12: 2019-08-21T00:00:00.000 | E12: 1590052619 | F12: =RC[1]/4 -> 16.8 | G12: 67.2 | H12: 43.607800000000005 | I12: =ROUND((RC[-2]*RC[-1]),2) -> 2930.44 | L12: Maximum Hourly Rate
A13: Heather Klussendorf | B13: Teacher | C13: 2019-06-14T00:00:00.000 | D13: 2019-08-21T00:00:00.000 | E13: 1001334780 | F13: =RC[1]/4 -> 17.600000000000001 | G13: 70.400000000000006 | H13: 36.549999999999997 | I13: =ROUND((RC[-2]*RC[-1]),2) -> 2573.12 | L13: 67.069999999999993
A15: cheri woelfl | B15: Teacher | C15: 2019-06-14T00:00:00.000 | D15: 2019-08-21T00:00:00.000 | E15: 1590074030 | F15: =RC[1]/4 -> 3.75 | G15: 15 | H15: 58.13 | I15: =ROUND((RC[-2]*RC[-1]),2) -> 871.95
A17: Maureen Mueller | B17: Supervisor | C17: 2019-06-14T00:00:00.000 | D17: 2019-08-21T00:00:00.000 | E17: 1590015250 | F17: =RC[1]/4 -> 1.4 | G17: 5.6 | H17: 67.069999999999993 | I17: =ROUND((RC[-2]*RC[-1]),2) -> 375.59
A18: Heidi Egner | B18: Supervisor | C18: 2019-06-14T00:00:00.000 | D18: 2019-08-21T00:00:00.000 | E18: 1590039829 | F18: =RC[1]/4 -> 1.6 | G18: 6.4 | H18: 64.819999999999993 | I18: =ROUND((RC[-2]*RC[-1]),2) -> 414.85
A20: TOTAL INSTRUCTION COST | G20: =SUM(R[-8]C:R[-1]C) -> 164.60000000000002 | I20: =(SUM(R[-8]C:R[-1]C)) -> 7165.95
A22: Counseling Calculation Detail
A23: Name | B23: Role | C23: Date of Background ck | D23: Date of Technology Acceptable Use | E23: License # | F23: Hours per week | G23: Hours | H23: Hourly Rate | I23: Charge for Counseling
I24: =ROUND((RC[-2]*RC[-1]),2) -> 0
I25: =ROUND((RC[-2]*RC[-1]),2) -> 0
I26: =ROUND((RC[-2]*RC[-1]),2) -> 0
I27: =ROUND((RC[-2]*RC[-1]),2) -> 0
I28: =ROUND((RC[-2]*RC[-1]),2) -> 0
I29: =ROUND((RC[-2]*RC[-1]),2) -> 0
I30: =ROUND((RC[-2]*RC[-1]),2) -> 0
I31: =ROUND((RC[-2]*RC[-1]),2) -> 0
I32: =ROUND((RC[-2]*RC[-1]),2) -> 0
I33: =ROUND((RC[-2]*RC[-1]),2) -> 0
A34: TOTAL COUNSELING CHARGES | I34: =SUM(R[-10]C:R[-1]C) -> 0
A35: ADDITIONAL EXPLANATORY NOTES:
A36: 12/3 and 12/5 P. Wickert out Jen Sholtes sub;12/18-12/20 SF Final Exams; 12/23-12/31 SC Winter Break

Sheet: St. Josaphat
H6: 2019-12-01T00:00:00.000
A9: School Name | B9: St. Josaphat | L9: Total Amount Instruction | M9: Total Amount Counseling
A10: Instruction Calculation Detail | L10: =R[12]C[-3] -> 18104.330000000002 | M10: =R[26]C[-4] -> 0
A11: Name | B11: Role | C11: Date of Background ck | D11: Date of Technology Acceptable Use | E11: License # | F11: Hours per week | G11: Hours | H11: Hourly Rate | I11: Charge for Instruction
A12: AMY Kochnowicz | B12: Teacher | C12: 2019-06-14T00:00:00.000 | D12: 2019-08-21T00:00:00.000 | E12: 1590035965 | F12: =RC[1]/4 -> 40 | G12: 160 | H12: 56.13 | I12: =ROUND((RC[-2]*RC[-1]),2) -> 8980.7999999999993 | J12: =SUM(RC[-1]:R[1]C[-1]) -> 17462.400000000001 | L12: Maximum Hourly Rate
A13: Jill magner | B13: Teacher | C13: 2019-06-14T00:00:00.000 | D13: 2019-08-21T00:00:00.000 | E13: 1590065908 | F13: =RC[1]/4 -> 40 | G13: 160 | H13: 53.01 | I13: =ROUND((RC[-2]*RC[-1]),2) -> 8481.6 | L13: 67.069999999999993
A16: Jennifer Sholtes | B16: Teacher | C16: 2019-06-14T00:00:00.000 | D16: 2019-08-21T00:00:00.000 | E16: 1001309662 | F16: =RC[1]/4 -> 2 | G16: 8 | H16: 40 | I16: =ROUND((RC[-2]*RC[-1]),2) -> 320
A20: Maureen Mueller | B20: Supervisor | C20: 2019-06-14T00:00:00.000 | D20: 2019-08-21T00:00:00.000 | E20: 1590015250 | F20: =RC[1]/4 -> 0.4 | G20: 1.6 | H20: 67.069999999999993 | I20: =ROUND((RC[-2]*RC[-1]),2) -> 107.31
A21: Holly Kriehn | B21: Supervisor | C21: 2019-09-23T00:00:00.000 | D21: 2019-10-17T00:00:00.000 | E21: 1001005329 | F21: 34 | G21: 3.2 | H21: 67.069999999999993 | I21: =ROUND((RC[-2]*RC[-1]),2) -> 214.62
A22: TOTAL INSTRUCTION COST | G22: =SUM(R[-10]C:R[-1]C) -> 332.8 | I22: =(SUM(R[-10]C:R[-1]C)) -> 18104.330000000002
A24: Counseling Calculation Detail
A25: Name | B25: Role | C25: Date of Background ck | D25: Date of Technology Acceptable Use | E25: License # | F25: Hours per week | G25: Hours | H25: Hourly Rate | I25: Charge for Counseling
I26: =ROUND((RC[-2]*RC[-1]),2) -> 0
I27: =ROUND((RC[-2]*RC[-1]),2) -> 0
I28: =ROUND((RC[-2]*RC[-1]),2) -> 0
I29: =ROUND((RC[-2]*RC[-1]),2) -> 0
I30: =ROUND((RC[-2]*RC[-1]),2) -> 0
I31: =ROUND((RC[-2]*RC[-1]),2) -> 0
I32: =ROUND((RC[-2]*RC[-1]),2) -> 0
I33: =ROUND((RC[-2]*RC[-1]),2) -> 0
I34: =ROUND((RC[-2]*RC[-1]),2) -> 0
I35: =ROUND((RC[-2]*RC[-1]),2) -> 0
A36: TOTAL COUNSELING CHARGES | I36: =SUM(R[-10]C:R[-1]C) -> 0
A37: ADDITIONAL EXPLANATORY NOTES:
A38: 12/19 TA Jill Magner Out, P. Kertzman Subbed 12/20-12/31 SC Winter Break

Sheet: St. Joseph - Tosa
A2: St. Joseph in Wauwatosa declined Title serves for the 19-20 school year. Principal didn't want a pull out program and parents were not willing to pick up their students for an after school program.

Sheet: St. Jude
H6: 2019-12-01T00:00:00.000
A9: School Name | B9: St. Jude | L9: Total Amount Instruction | M9: Total Amount Counseling
A10: Instruction Calculation Detail | L10: =R[20]C[-3] -> 786.44 | M10: =R[34]C[-4] -> 0
A11: Name | B11: Role | C11: Date of Background ck | D11: Date of Technology Acceptable Use | E11: License # | F11: Hours per week | G11: Hours | H11: Hourly Rate | I11: Charge for Instruction
A12: Katherine Leszczynski | B12: Teacher | C12: 2019-06-24T00:00:00.000 | D12: 2019-08-21T00:00:00.000 | E12: 1001309826 | F12: =RC[1]/4 -> 2.625 | G12: 10.5 | H12: 66 | I12: =ROUND((RC[-2]*RC[-1]),2) -> 693 | L12: Maximum Hourly Rate
L13: 67.069999999999993
A29: Jane Haessly | B29: Supervisor | C29: 2019-06-14T00:00:00.000 | D29: 2019-08-21T00:00:00.000 | E29: 1590004207 | F29: =RC[1]/4 -> 0.4 | G29: 1.6 | H29: 58.4 | I29: =ROUND((RC[-2]*RC[-1]),2) -> 93.44
A30: TOTAL INSTRUCTION COST | G30: =SUM(R[-18]C:R[-1]C) -> 12.1 | I30: =(SUM(R[-18]C:R[-1]C)) -> 786.44
A32: Counseling Calculation Detail
A33: Name | B33: Role | C33: Date of Background ck | D33: Date of Technology Acceptable Use | E33: License # | F33: Hours per week | G33: Hours | H33: Hourly Rate | I33: Charge for Counseling
I34: =ROUND((RC[-2]*RC[-1]),2) -> 0
I35: =ROUND((RC[-2]*RC[-1]),2) -> 0
I36: =ROUND((RC[-2]*RC[-1]),2) -> 0
I37: =ROUND((RC[-2]*RC[-1]),2) -> 0
I38: =ROUND((RC[-2]*RC[-1]),2) -> 0
I39: =ROUND((RC[-2]*RC[-1]),2) -> 0
I40: =ROUND((RC[-2]*RC[-1]),2) -> 0
I41: =ROUND((RC[-2]*RC[-1]),2) -> 0
I42: =ROUND((RC[-2]*RC[-1]),2) -> 0
I43: =ROUND((RC[-2]*RC[-1]),2) -> 0
A44: TOTAL COUNSELING CHARGES | I44: =SUM(R[-10]C:R[-1]C) -> 0
A45: ADDITIONAL EXPLANATORY NOTES:
A46: 12/23-12/31 SC Christmas Vacation

Sheet: St. Marcus
H6: 2019-12-01T00:00:00.000
A9: School Name | B9: St. Marcus | L9: Total Amount Instruction | M9: Total Amount Counseling
A10: Instruction Calculation Detail | L10: =R[17]C[-3] -> 51372.569999999992 | M10: =R[31]C[-4] -> 0
A11: Name | B11: Role | C11: Date of Background ck | D11: Date of Technology Acceptable Use | E11: License # | F11: Hours per week | G11: Hours | H11: Hourly Rate | I11: Charge for Instruction
A12: Joylyn Rehm | B12: Teacher | C12: 2019-06-14T00:00:00.000 | D12: 2019-08-21T00:00:00.000 | E12: 1590036051 | F12: =RC[1]/4 -> 38 | G12: 152 | H12: 62.29 | I12: =ROUND((RC[-2]*RC[-1]),2) -> 9468.08 | L12: Maximum Hourly Rate
A13: Kathy Weiss | B13: Teacher | C13: 2019-06-14T00:00:00.000 | D13: 2019-08-21T00:00:00.000 | E13: 1590024790 | F13: =RC[1]/4 -> 40 | G13: 160 | H13: 63.49 | I13: =ROUND((RC[-2]*RC[-1]),2) -> 10158.4 | L13: 67.069999999999993
A14: Maureen Hanley | B14: Teacher | C14: 2019-06-14T00:00:00.000 | D14: 2019-08-21T00:00:00.000 | E14: 1001006192 | F14: =RC[1]/4 -> 40 | G14: 160 | H14: 64.39 | I14: =ROUND((RC[-2]*RC[-1]),2) -> 10302.4
A15: Emily Kinzinger | B15: Teacher | C15: 2019-06-14T00:00:00.000 | D15: 2019-08-21T00:00:00.000 | E15: 1590072079 | F15: =RC[1]/4 -> 39 | G15: 156 | H15: 60.1 | I15: =ROUND((RC[-2]*RC[-1]),2) -> 9375.6
A17: Jennifer Sholtes | B17: Teacher | C17: 2019-06-14T00:00:00.000 | D17: 2019-08-21T00:00:00.000 | E17: 1001309662 | F17: =RC[1]/4 -> 6 | G17: 24 | H17: 40 | I17: =ROUND((RC[-2]*RC[-1]),2) -> 960
A18: Pat Kerzman | B18: Teacher | C18: 2019-06-14T00:00:00.000 | D18: 2019-08-21T00:00:00.000 | E18: 1590017009 | F18: =RC[1]/4 -> 4 | G18: 16 | H18: 67.069999999999993 | I18: =ROUND((RC[-2]*RC[-1]),2) -> 1073.1199999999999
A19: Rachel Plakut | B19: Teacher | C19: 2019-06-14T00:00:00.000 | D19: 2019-08-21T00:00:00.000 | E19: 1590075508 | F19: =RC[1]/4 -> 2 | G19: 8 | H19: 65.11 | I19: =ROUND((RC[-2]*RC[-1]),2) -> 520.88
A22: Heidi Egner | B22: Supervisor | C22: 2019-06-14T00:00:00.000 | D22: 2019-08-21T00:00:00.000 | E22: 1590039829 | F22: =RC[1]/4 -> 16 | G22: 64 | H22: 64.819999999999993 | I22: =ROUND((RC[-2]*RC[-1]),2) -> 4148.4799999999996
A23: Sue Biehn | B23: Supervisor | C23: 2019-06-14T00:00:00.000 | D23: 2019-08-21T00:00:00.000 | E23: 1590057967 | F23: =RC[1]/4 -> 5.2 | G23: 20.8 | H23: 67.069999999999993 | I23: =ROUND((RC[-2]*RC[-1]),2) -> 1395.06
A24: Robin Buboltz | B24: Supervisor | C24: 2019-06-14T00:00:00.000 | D24: 2019-08-21T00:00:00.000 | E24: 1590066648 | F24: =RC[1]/4 -> 7.6 | G24: 30.4 | H24: 67.069999999999993 | I24: =ROUND((RC[-2]*RC[-1]),2) -> 2038.93
A25: Ellen Sternig | B25: Supervisor | C25: 2019-06-14T00:00:00.000 | D25: 2019-08-21T00:00:00.000 | E25: 2800004552 | F25: =RC[1]/4 -> 1.2 | G25: 4.8 | H25: 67.069999999999993 | I25: =ROUND((RC[-2]*RC[-1]),2) -> 321.94
A26: Joelle Amberg | B26: Supervisor | C26: 2019-06-14T00:00:00.000 | D26: 2019-08-21T00:00:00.000 | E26: 1590047303 | F26: =RC[1]/4 -> 6 | G26: 24 | H26: 67.069999999999993 | I26: =ROUND((RC[-2]*RC[-1]),2) -> 1609.68
A27: TOTAL INSTRUCTION COST | G27: =SUM(R[-15]C:R[-1]C) -> 819.99999999999989 | I27: =(SUM(R[-15]C:R[-1]C)) -> 51372.569999999992
A29: Counseling Calculation Detail
A30: Name | B30: Role | C30: Date of Background ck | D30: Date of Technology Acceptable Use | E30: License # | F30: Hours per week | G30: Hours | H30: Hourly Rate | I30: Charge for Counseling
I31: =ROUND((RC[-2]*RC[-1]),2) -> 0
I32: =ROUND((RC[-2]*RC[-1]),2) -> 0
I33: =ROUND((RC[-2]*RC[-1]),2) -> 0
I34: =ROUND((RC[-2]*RC[-1]),2) -> 0
I35: =ROUND((RC[-2]*RC[-1]),2) -> 0
I36: =ROUND((RC[-2]*RC[-1]),2) -> 0
I37: =ROUND((RC[-2]*RC[-1]),2) -> 0
I38: =ROUND((RC[-2]*RC[-1]),2) -> 0
I39: =ROUND((RC[-2]*RC[-1]),2) -> 0
I40: =ROUND((RC[-2]*RC[-1]),2) -> 0
A41: TOTAL COUNSELING CHARGES | I41: =SUM(R[-10]C:R[-1]C) -> 0
A42: ADDITIONAL EXPLANATORY NOTES:
A43: 12/16 TA: No sub available, 12/20 - SC half day, 12/23-12/31 - SC: Winter Break

Sheet: St. Philips
H6: 2019-12-01T00:00:00.000
A9: School Name | B9: St. Philips | L9: Total Amount Instruction | M9: Total Amount Counseling
A10: Instruction Calculation Detail | L10: =R[31]C[-3] -> 8720.69 | M10: =R[45]C[-4] -> 0
A11: Name | B11: Role | C11: Date of Background ck | D11: Date of Technology Acceptable Use | E11: License # | F11: Hours per week | G11: Hours | H11: Hourly Rate | I11: Charge for Instruction
A12: Hayley Moldenhauer | B12: Teacher | C12: 2019-06-14T00:00:00.000 | D12: 2019-08-21T00:00:00.000 | E12: 1590049612 | F12: =RC[1]/4 -> 36 | G12: 144 | H12: 49.5 | I12: =ROUND((RC[-2]*RC[-1]),2) -> 7128 | L12: Maximum Hourly Rate
A15: Cassie Theobald | B15: Supervisor | C15: 2019-06-14T00:00:00.000 | D15: 2019-08-21T00:00:00.000 | E15: 1590019859 | F15: =RC[1]/4 -> 0.4 | G15: 1.6 | H15: 64.88 | I15: =ROUND((RC[-2]*RC[-1]),2) -> 103.81
A16: Jane Haessly | B16: Supervisor | C16: 2019-06-14T00:00:00.000 | D16: 2019-08-21T00:00:00.000 | E16: 1590004207 | F16: =RC[1]/4 -> 5.2 | G16: 20.8 | H16: 58.4 | I16: =ROUND((RC[-2]*RC[-1]),2) -> 1214.72
A17: Maureen Polczynski | B17: Supervisor | C17: 2019-06-14T00:00:00.000 | D17: 2019-08-21T00:00:00.000 | E17: 176099 | F17: =RC[1]/4 -> 2 | G17: 8 | H17: 34.270000000000003 | I17: =ROUND((RC[-2]*RC[-1]),2) -> 274.16000000000003
A41: TOTAL INSTRUCTION COST | G41: =SUM(R[-29]C:R[-1]C) -> 174.4 | I41: =(SUM(R[-29]C:R[-1]C)) -> 8720.69
A43: Counseling Calculation Detail
A44: Name | B44: Role | C44: Date of Background ck | D44: Date of Technology Acceptable Use | E44: License # | F44: Hours per week | G44: Hours | H44: Hourly Rate | I44: Charge for Counseling
I45: =ROUND((RC[-2]*RC[-1]),2) -> 0
I46: =ROUND((RC[-2]*RC[-1]),2) -> 0
I47: =ROUND((RC[-2]*RC[-1]),2) -> 0
I48: =ROUND((RC[-2]*RC[-1]),2) -> 0
I49: =ROUND((RC[-2]*RC[-1]),2) -> 0
I50: =ROUND((RC[-2]*RC[-1]),2) -> 0
I51: =ROUND((RC[-2]*RC[-1]),2) -> 0
I52: =ROUND((RC[-2]*RC[-1]),2) -> 0
I53: =ROUND((RC[-2]*RC[-1]),2) -> 0
I54: =ROUND((RC[-2]*RC[-1]),2) -> 0
A55: TOTAL COUNSELING CHARGES | I55: =SUM(R[-10]C:R[-1]C) -> 0
A56: ADDITIONAL EXPLANATORY NOTES:
A57: 12/20 SC 1/2 Day 12/23-12/31 SC Winter Break

Sheet: Shining Star
H6: 2019-12-01T00:00:00.000
A9: School Name | B9: Shining Star | L9: Total Amount Instruction | M9: Total Amount Counseling
A10: Instruction Calculation Detail | L10: =R[12]C[-3] -> 26949.040000000001 | M10: =R[26]C[-4] -> 0
A11: Name | B11: Role | C11: Date of Background ck | D11: Date of Technology Acceptable Use | E11: License # | F11: Hours per week | G11: Hours | H11: Hourly Rate | I11: Charge for Instruction
A12: Sheila Giricz | B12: Teacher | C12: 2019-06-14T00:00:00.000 | D12: 2019-08-21T00:00:00.000 | E12: 1590006935 | F12: =RC[1]/4 -> 24 | G12: 96 | H12: 48.72 | I12: =ROUND((RC[-2]*RC[-1]),2) -> 4677.12 | L12: Maximum Hourly Rate
A13: Dawn Kielpikowski | B13: Teacher | C13: 2019-07-23T00:00:00.000 | D13: 2019-08-21T00:00:00.000 | E13: 1590023735 | F13: =RC[1]/4 -> 37 | G13: 148 | H13: 67.069999999999993 | I13: =ROUND((RC[-2]*RC[-1]),2) -> 9926.36 | L13: 67.069999999999993
A14: Roberto Melian | B14: Teacher | C14: 2019-06-14T00:00:00.000 | D14: 2019-08-21T00:00:00.000 | E14: 1590073934 | F14: =RC[1]/4 -> 37.25 | G14: 149 | H14: 64.900000000000006 | I14: =ROUND((RC[-2]*RC[-1]),2) -> 9670.1
A16: Pat Kerzman | B16: Teacher | C16: 2019-06-14T00:00:00.000 | D16: 2019-08-21T00:00:00.000 | E16: 1590017009 | F16: =RC[1]/4 -> 1 | G16: 4 | H16: 67.069999999999993 | I16: =ROUND((RC[-2]*RC[-1]),2) -> 268.27999999999997
A18: Robin Buboltz | B18: Supervisor | C18: 2019-06-14T00:00:00.000 | D18: 2019-08-21T00:00:00.000 | E18: 020515 | F18: =RC[1]/4 -> 0.8 | G18: 3.2 | H18: 67.069999999999993 | I18: =ROUND((RC[-2]*RC[-1]),2) -> 214.62
A19: Jane Haessly | B19: Supervisor | C19: 2019-06-14T00:00:00.000 | D19: 2019-08-21T00:00:00.000 | E19: 043900 | F19: 40 | G19: 25.6 | H19: 58.4 | I19: =ROUND((RC[-2]*RC[-1]),2) -> 1495.04
A20: Holly Kriehn | B20: Supervisor | C20: 2019-09-23T00:00:00.000 | D20: 2019-10-17T00:00:00.000 | E20: 1001005329 | F20: 34 | G20: 3.2 | H20: 67.069999999999993 | I20: =ROUND((RC[-2]*RC[-1]),2) -> 214.62
A21: Ellen Sternig | B21: Supervisor | C21: 2019-06-14T00:00:00.000 | D21: 2019-08-21T00:00:00.000 | E21: 122872 | F21: =RC[1]/4 -> 1.8 | G21: 7.2 | H21: 67.069999999999993 | I21: =ROUND((RC[-2]*RC[-1]),2) -> 482.9
A22: TOTAL INSTRUCTION COST | G22: =SUM(R[-10]C:R[-1]C) -> 436.2 | I22: =(SUM(R[-10]C:R[-1]C)) -> 26949.040000000001
A24: Counseling Calculation Detail
A25: Name | B25: Role | C25: Date of Background ck | D25: Date of Technology Acceptable Use | E25: License # | F25: Hours per week | G25: Hours | H25: Hourly Rate | I25: Charge for Counseling
I26: =ROUND((RC[-2]*RC[-1]),2) -> 0
I27: =ROUND((RC[-2]*RC[-1]),2) -> 0
I28: =ROUND((RC[-2]*RC[-1]),2) -> 0
I29: =ROUND((RC[-2]*RC[-1]),2) -> 0
I30: =ROUND((RC[-2]*RC[-1]),2) -> 0
I31: =ROUND((RC[-2]*RC[-1]),2) -> 0
I32: =ROUND((RC[-2]*RC[-1]),2) -> 0
I33: =ROUND((RC[-2]*RC[-1]),2) -> 0
I34: =ROUND((RC[-2]*RC[-1]),2) -> 0
I35: =ROUND((RC[-2]*RC[-1]),2) -> 0
A36: TOTAL COUNSELING CHARGES | I36: =SUM(R[-10]C:R[-1]C) -> 0
A37: ADDITIONAL EXPLANATORY NOTES:
A38: 12/9 TA Dawn Kielpikowski Out, R. Geislinger Subbed 12/23-12/31 SC Winter Break

Sheet: Word of Life
H6: 2019-12-01T00:00:00.000
A9: School Name | B9: Word of Life | L9: Total Amount Instruction | M9: Total Amount Counseling
A10: Instruction Calculation Detail | L10: =R[12]C[-3] -> 6717.4500000000007 | M10: =R[26]C[-4] -> 0
A11: Name | B11: Role | C11: Date of Background ck | D11: Date of Technology Acceptable Use | E11: License # | F11: Hours per week | G11: Hours | H11: Hourly Rate | I11: Charge for Instruction
A12: dana smith | B12: Teacher | C12: 2019-06-14T00:00:00.000 | D12: 2019-08-21T00:00:00.000 | E12: 1590004267 | F12: =RC[1]/4 -> 0 | G12: 0 | H12: 54 | I12: =ROUND((RC[-2]*RC[-1]),2) -> 0 | L12: Maximum Hourly Rate
A13: Pat Kerzman | B13: Teacher | C13: 2019-06-14T00:00:00.000 | D13: 2019-08-21T00:00:00.000 | E13: 1590017009 | F13: =RC[1]/4 -> 20 | G13: 80 | H13: 67.069999999999993 | I13: =ROUND((RC[-2]*RC[-1]),2) -> 5365.6 | L13: 67.069999999999993
A20: Heidi Egner | B20: Supervisor | C20: 2019-06-14T00:00:00.000 | D20: 2019-08-21T00:00:00.000 | E20: 1590039829 | F20: =RC[1]/4 -> 4.8 | G20: 19.2 | H20: 64.819999999999993 | I20: =ROUND((RC[-2]*RC[-1]),2) -> 1244.54
A21: Liana Jones | B21: Supervisor | C21: 2019-06-14T00:00:00.000 | D21: 2019-08-21T00:00:00.000 | E21: 1590059525 | F21: =RC[1]/4 -> 0.4 | G21: 1.6 | H21: 67.069999999999993 | I21: =ROUND((RC[-2]*RC[-1]),2) -> 107.31
A22: TOTAL INSTRUCTION COST | G22: =SUM(R[-10]C:R[-1]C) -> 100.8 | I22: =(SUM(R[-10]C:R[-1]C)) -> 6717.4500000000007
A24: Counseling Calculation Detail
A25: Name | B25: Role | C25: Date of Background ck | D25: Date of Technology Acceptable Use | E25: License # | F25: Hours per week | G25: Hours | H25: Hourly Rate | I25: Charge for Counseling
I26: =ROUND((RC[-2]*RC[-1]),2) -> 0
I27: =ROUND((RC[-2]*RC[-1]),2) -> 0
I28: =ROUND((RC[-2]*RC[-1]),2) -> 0
I29: =ROUND((RC[-2]*RC[-1]),2) -> 0
I30: =ROUND((RC[-2]*RC[-1]),2) -> 0
I31: =ROUND((RC[-2]*RC[-1]),2) -> 0
I32: =ROUND((RC[-2]*RC[-1]),2) -> 0
I33: =ROUND((RC[-2]*RC[-1]),2) -> 0
I34: =ROUND((RC[-2]*RC[-1]),2) -> 0
I35: =ROUND((RC[-2]*RC[-1]),2) -> 0
A36: TOTAL COUNSELING CHARGES | I36: =SUM(R[-10]C:R[-1]C) -> 0
A37: ADDITIONAL EXPLANATORY NOTES:
A38: 12/1-12/19 - TA; Dana Smith absent on maternity leave, Pat Kertzman subbing, 12/13 - Sub Suzanne Hurst, 12/20 - SC: half day, 12-23-12/31- SC: Winter Break

Sheet: Zion
H6: 2019-12-01T00:00:00.000
A9: School Name | B9: Zion Lutheran | L9: Total Amount Instruction | M9: Total Amount Counseling
A10: Instruction Calculation Detail | L10: =R[17]C[-3] -> 1099.02 | M10: =R[31]C[-4] -> 0
A11: Name | B11: Role | C11: Date of Background ck | D11: Date of Technology Acceptable Use | E11: License # | F11: Hours per week | G11: Hours | H11: Hourly Rate | I11: Charge for Instruction
A12: Katie Schmidt | B12: Teacher | C12: 2019-06-14T00:00:00.000 | D12: 2019-08-21T00:00:00.000 | E12: 1001095920 | F12: =RC[1]/4 -> 6 | G12: 24 | H12: 37 | I12: =ROUND((RC[-2]*RC[-1]),2) -> 888 | L12: Maximum Hourly Rate
L13: 67.069999999999993
A25: Holly Kriehn | B25: Supervisor | C25: 2019-09-23T00:00:00.000 | D25: 2019-10-17T00:00:00.000 | E25: 1001005329 | F25: 34 | G25: 1.6 | H25: 67.069999999999993 | I25: =ROUND((RC[-2]*RC[-1]),2) -> 107.31
A26: Heidi Egner | B26: Supervisor | C26: 2019-06-14T00:00:00.000 | D26: 2019-08-21T00:00:00.000 | E26: 1590039829 | F26: =RC[1]/4 -> 0.4 | G26: 1.6 | H26: 64.819999999999993 | I26: =ROUND((RC[-2]*RC[-1]),2) -> 103.71
A27: TOTAL INSTRUCTION COST | G27: =SUM(R[-15]C:R[-1]C) -> 27.200000000000003 | I27: =(SUM(R[-15]C:R[-1]C)) -> 1099.02
A29: Counseling Calculation Detail
A30: Name | B30: Role | C30: Date of Background ck | D30: Date of Technology Acceptable Use | E30: License # | F30: Hours per week | G30: Hours | H30: Hourly Rate | I30: Charge for Counseling
I31: =ROUND((RC[-2]*RC[-1]),2) -> 0
I32: =ROUND((RC[-2]*RC[-1]),2) -> 0
I33: =ROUND((RC[-2]*RC[-1]),2) -> 0
I34: =ROUND((RC[-2]*RC[-1]),2) -> 0
I35: =ROUND((RC[-2]*RC[-1]),2) -> 0
I36: =ROUND((RC[-2]*RC[-1]),2) -> 0
I37: =ROUND((RC[-2]*RC[-1]),2) -> 0
I38: =ROUND((RC[-2]*RC[-1]),2) -> 0
I39: =ROUND((RC[-2]*RC[-1]),2) -> 0
I40: =ROUND((RC[-2]*RC[-1]),2) -> 0
A41: TOTAL COUNSELING CHARGES | I41: =SUM(R[-10]C:R[-1]C) -> 0
A42: ADDITIONAL EXPLANATORY NOTES:
A43: 12/23-12/31 SC Winter Break

Sheet: Totals
A1: counseling | B1: instruction
A2: =SUM(Atlas:Zion!R[54]C[8]) -> 0 | B2: =Zion!R[8]C[10]+'Word of Life'!R[8]C[10]+'El Puente'!R[8]C[10]+'City School'!R[8]C[10]+'Shining Star'!R[8]C[10]+'St. Philips'!R[8]C[10]+'St. Marcus'!R[8]C[10]+'St. Jude'!R[8]C[10]+'St. Josaphat'!R[8]C[10]+'St. Joan Antida'!R[8]C[10]+'St. Gregory'!R[8]C[10]+'St. Anthony'!R[8]C[10]+'Risen Savior'!R[8]C[10]+'Notre Dame'!R[8]C[10]+'Nativity Jesuit'!R[8]C[10]+Messmer!R[8]C[10]+'Kingdom Prep HS'!R[8]C[10]+'Hope Semper'!R[8]C[10]+'Hope Prima'!R[8]C[10]+'Hope HS'!R[8]C[10]+'Hope Fortis'!R[8]C[10]+'Hope Fidelis'!R[8]C[10]+'Hope Caritas'!R[8]C[10]+'Grace Christian'!R[8]C[10]+'Elm Grove'!R[8]C[10]+'Cross Trainers'!R[8]C[10]+'Christ King'!R[8]C[10]+Atlas!R[8]C[10] -> 692366.87999999989