Sheet: Cross Trainers
H6: 2019-12-01T00:00:00.000
A9: School Name | B9: Cross Trainers | L9: Total Amount Instruction | M9: Total Amount Counseling
A10: Instruction Calculation Detail | L10: =R[14]C[-3] -> 29229.66 | M10: =R[28]C[-4] -> 0
A11: Name | B11: Role | C11: Date of Background ck | D11: Date of Technology Acceptable Use | E11: License # | F11: Hours per week | G11: Hours | H11: Hourly Rate | I11: Charge for Instruction
A12: Janet Boehlke | B12: Teacher | C12: 2019-06-14T00:00:00.000 | D12: 2019-08-21T00:00:00.000 | E12: 1590056097 | F12: =RC[1]/4 -> 40 | G12: 160 | H12: 67.069999999999993 | I12: =ROUND((RC[-2]*RC[-1]),2) -> 10731.2 | J12: =SUM(RC[-1]:R[1]C[-1]) -> 21462.400000000001 | L12: Maximum Hourly Rate
A13: Susan arends | B13: Teacher | C13: 2019-06-27T00:00:00.000 | D13: 2019-08-21T00:00:00.000 | E13: 1590018785 | F13: =RC[1]/4 -> 40 | G13: 160 | H13: 67.069999999999993 | I13: =ROUND((RC[-2]*RC[-1]),2) -> 10731.2 | L13: 67.069999999999993
A15: Possible new teacher | F15: 16 | G15: 64 | H15: 43 | I15: =ROUND((RC[-2]*RC[-1]),2) -> 2752
A16: Jennifer Sholtes | B16: Teacher | C16: 2019-06-14T00:00:00.000 | D16: 2019-08-21T00:00:00.000 | E16: 1001309662 | F16: =RC[1]/4 -> 2 | G16: 8 | H16: 40 | I16: =ROUND((RC[-2]*RC[-1]),2) -> 320
A17: Teresa Mueller | B17: Teacher | C17: 2019-06-14T00:00:00.000 | D17: 2019-08-21T00:00:00.000 | E17: 1590005537 | F17: =RC[1]/4 -> 6 | G17: 24 | H17: 53.06 | I17: =ROUND((RC[-2]*RC[-1]),2) -> 1273.44
A19: Cassie Theobald | B19: Supervisor | C19: 2019-06-14T00:00:00.000 | D19: 2019-08-21T00:00:00.000 | E19: 1590019859 | F19: =RC[1]/4 -> 1.6 | G19: 6.4 | H19: 64.88 | I19: =ROUND((RC[-2]*RC[-1]),2) -> 415.23
A20: Jane Haessly | B20: Supervisor | C20: 2019-06-14T00:00:00.000 | D20: 2019-08-21T00:00:00.000 | E20: 1590004207 | F20: 40 | G20: 25.6 | H20: 58.4 | I20: =ROUND((RC[-2]*RC[-1]),2) -> 1495.04
A21: Maureen Polczynski | B21: Supervisor | C21: 2019-06-14T00:00:00.000 | D21: 2019-08-21T00:00:00.000 | E21: 176099 | F21: =RC[1]/4 -> 0.8 | G21: 3.2 | H21: 34.270000000000003 | I21: =ROUND((RC[-2]*RC[-1]),2) -> 109.66
A22: Jennifer Hockett | B22: Supervisor | C22: 2019-06-14T00:00:00.000 | D22: 2019-08-21T00:00:00.000 | E22: 1590039078 | F22: =RC[1]/4 -> 4 | G22: 16 | H22: 60.79 | I22: =ROUND((RC[-2]*RC[-1]),2) -> 972.64
A23: Robin Buboltz | B23: Supervisor | C23: 2019-06-14T00:00:00.000 | D23: 2019-08-21T00:00:00.000 | E23: 1590066648 | F23: =RC[1]/4 -> 1.6 | G23: 6.4 | H23: 67.069999999999993 | I23: =ROUND((RC[-2]*RC[-1]),2) -> 429.25
A24: TOTAL INSTRUCTION COST | G24: =SUM(R[-12]C:R[-1]C) -> 473.59999999999997 | I24: =(SUM(R[-12]C:R[-1]C)) -> 29229.66
A26: Counseling Calculation Detail
A27: Name | B27: Role | C27: Date of Background ck | D27: Date of Technology Acceptable Use | E27: License # | F27: Hours per week | G27: Hours | H27: Hourly Rate | I27: Charge for Counseling
I28: =ROUND((RC[-2]*RC[-1]),2) -> 0
I29: =ROUND((RC[-2]*RC[-1]),2) -> 0
I30: =ROUND((RC[-2]*RC[-1]),2) -> 0
I31: =ROUND((RC[-2]*RC[-1]),2) -> 0
I32: =ROUND((RC[-2]*RC[-1]),2) -> 0
I33: =ROUND((RC[-2]*RC[-1]),2) -> 0
I34: =ROUND((RC[-2]*RC[-1]),2) -> 0
I35: =ROUND((RC[-2]*RC[-1]),2) -> 0
I36: =ROUND((RC[-2]*RC[-1]),2) -> 0
I37: =ROUND((RC[-2]*RC[-1]),2) -> 0
A38: TOTAL COUNSELING CHARGES | I38: =SUM(R[-10]C:R[-1]C) -> 0
A39: ADDITIONAL EXPLANATORY NOTES:
A40: 12/4 - J. Boehlke out 1/2 day (PM) No sub available. 12/23-12/31 SC Winter Break